controlCategory,controlType,controLPeriodocityEnglish,control,controlID
Other,Manual,Annualy,Implement performance controls on the data received,1849
Other,Missing,Missing,Check compliance with deadlines,374
Operational,Semi-automatic,Per event,Verification of system validation,2181
Other,Semi-automatic,Per event,Verify signatures and powers of signature,2728
Other,Manual,Quarterly,Verify the correctness of the entered data / comment,3703
Other,Manual,Quarterly,Check the consistency of the contribution,1097
Other,Manual,Quarterly,Verify the correctness of the power sources,3760
Other,Manual,Quarterly,Verify that all contributions have been validated,2750
Other,Semi-automatic,Per event,Check operating curve calculation,699
Professional,Manual,Quarterly,Check the completeness and correctness of the scope of application,1013
Other,Semi-automatic,Quarterly,Verify the calculation of prudent value measures,2971
Operational,Semi-automatic,Monthly,Perform checks on received data,2000
Other,Manual,Per event,Verify the correct debit of the account,3319
Other,Manual,Per event,Check and authorize the sending of swift messages,323
Professional,Manual,Per event,Check the dossier submitted by the operator,1410
Other,Manual,Per event,Verify that the rates entered are correct,2853
Other,Manual,Per event,Check alignment of balances and block account,316
Other,Manual,Per event,Check the correctness of the updated rates,1303
Other,Manual,Per event,Check the correctness of the interest amount calculated by the correspondent bank,1284
Other,Semi-automatic,Per event,Verify the correct calculation of interest,3255
Other,Missing,Missing,Carry out a trend check,129
Other,Missing,Missing,The structure in charge verifies the consistency of the economic data of the financial statements and of the management data (input data).,2124
Other,Semi-automatic,Daily,Check the sending of daily streams,1628
Other,Semi-automatic,Daily,Perform technical checks on Lookout,2019
Other,Semi-automatic,Daily,Perform Legacy Engineering Checks,1995
Other,Other,N.A.,Carry out checks on any cancellation operations subject to reporting,146
Other,Other,N.A.,Carry out checks on the cancellation operations subject to reporting,150
Professional,Semi-automatic,Per event,Check the classification of the Supplier/Sub-supplier/Dealer and the presence of the Privacy Consent,975
Professional,Manual,Per event,Verify that data in ABC or @gile is loaded to calculate the rating correctly,2765
Professional,Semi-automatic,Per event,Verify correct update,2504
Operational,Other,N.A.,Check that the management system is correctly fed,827
Other,Manual,Per event,Check the received data,1568
Other,Manual,Per event,Verify the accounting entry made,2927
Other,Manual,Daily,View operational reports in ABC,4054
Other,Manual,Per event,Check index values present in the platform,665
Other,Manual,Per event,Verify correct shipping reporting,2495
Operational,Missing,Missing,Carry out the required controls for completing the electronic control traceability form (form 1B),248
Other,Missing,Missing,Carry out the required controls for completing the electronic control traceability form (form 1A),247
Other,Manual,Per event,Check correct entry of financial data,398
Other,Manual,Per event,Verify the completeness and consistency of the request for extinction with the contractual details and with the time constraints,3012
Other,Manual,Per event,Verify the redemption reservation (only for collateralized transactions for ABACO purposes),3998
Other,Manual,Per event,Check for the presence of funds on the early repayment day,619
Other,Manual,Per event,Check that DG deliverables have been updated,758
Other,Manual,Per event,Verify the correct production of the Data Governance deliverables,3446
Other,Manual,Per event,Verify the correctness of the uploaded invoices,3800
Other,Manual,Per event,Check for possible rejects,588
Other,Manual,Monthly,Check for any forecast errors,521
Other,Manual,Monthly,Check data fed by the system,439
Other,Manual,Per event,Check for updates for the current month,637
Other,Manual,Per event,Verify expense recovery data,2609
Other,Manual,Per event,Check the correspondence between the pre-confirmation and Kondor+ London,1317
Other,Manual,Per event,Verify that the Client is enabled to operate,2776
Other,Manual,Per event,Ascertain the existence/capacity of the Credit Line,92
Other,Manual,Per event,Verify the correctness of the issuers,3743
Operational,Manual,Monthly,Verify the quality of the data following the corrections,3988
Other,Manual,Per event,Verify the correct entry of questions and resolutions,3348
Other,Missing,Missing,Check for any legislative changes,526
Other,Manual,Annualy,Verify the correct and complete compilation of the F24 form,3205
Other,Manual,Annualy,Verify the correctness of the payment made,3754
Other,Missing,Missing,"Verify compliance with the gross year income limit, where applicable",2333
Professional,Semi-automatic,Per event,Check existing positions,484
Professional,Semi-automatic,Per event,Verify the Congruence of the Operation on the Position Keeping,2905
Professional,Manual,Per event,Verify that the data is entered correctly,2816
Operational,Missing,Missing,Verify integration of PCI DSS compliance program status into annual Security Plan,2627
Other,Semi-automatic,Per event,Check for unmatched contracts,632
Other,Semi-automatic,Monthly,Verify the complete fulfillment of the reliefs,3005
Other,Semi-automatic,Monthly,Verify the consistency of the reporting flow in ITS EBA format and carry out performance checks,3131
Other,Semi-automatic,Monthly,Check diagnostic evidence,450
Other,Semi-automatic,Monthly,Please check the submission for completeness and correctness,2026
Other,Manual,Per event,Check impact on parameters,661
Other,Manual,Per event,Check the correctness of the calculation,1249
Other,Manual,Per event,Check the correct identification of the thresholds,1191
Other,Manual,Per event,Check intervention actions,670
Other,Semi-automatic,Per event,Check the results,1616
Other,Manual,Quarterly,Verify the correctness of the impairment indicators,3726
Other,Manual,Annualy,Verify the correct compilation of the Explanatory Notes for the parts concerning the impairment test of intangible assets,3285
Other,Manual,Annualy,Check for the absence of critical signals,608
Other,Manual,Quarterly,Check for Impairment signals,491
Other,Manual,Annualy,Verify the correctness of the defined journal entry,3688
Other,Semi-automatic,Monthly,Verify the correctness of the data entered and the bank reconciliations carried out,3660
Other,Manual,Per event,Verify correct execution of Cancel and Reissue,2455
Other,Manual,Per event,Verify evaluation correctness,2594
Other,Manual,Per event,Verify correctness of evaluation,2532
Other,Missing,Missing,Verify the transposition of the observations received within the final documentation,4035
Other,Manual,Per event,Evaluate the correctness of the assessment,1815
Other,Manual,Per event,Verify data correctness,2561
Other,Missing,Missing,Verify the completeness of the acquired documentation,3041
Other,Missing,Missing,Verify the abstention management methods,2918
Other,Manual,Per event,Check blocked operations,350
Other,Semi-automatic,Per event,Check for anomalies and request accommodation,498
Other,Semi-automatic,Daily,Check for squaring,601
Other,Manual,Daily,Verify correctness of data,2531
Other,Manual,Per event,Tick settlement instructions,2134
Other,Manual,Daily,Check the consistency of the Market Hub data,1092
Other,Manual,Per event,Communicate mismatches,1752
Operational,Missing,Missing,Verify the effective implementation of the countermeasures,3862
Operational,Manual,Per event,Verify the correctness of the deduction of withholding taxes in the tax return,3687
Operational,Manual,Annualy,Verify the receipt of the specific schedule regarding withholding taxes incurred abroad,3994
Operational,Manual,Per event,Verify the correctness of the documentation submitted by the customer,3696
Operational,Manual,Per event,Verify the correctness of the amount returned to the Customer,3607
Other,Semi-automatic,Annualy,Check that the catalog has been published,791
Other,Semi-automatic,Annualy,Verify the success of the generation of the outsourcing database,4019
Other,Semi-automatic,Annualy,Verify the complete and correct updating of the Outsourcing Register,3002
Other,Manual,Per event,Examine and verify the adequacy of documents,1828
Other,Manual,Per event,Check the amount received from ISMEA,933
Other,Missing,Missing,Check the correctness/completeness of completing the application,1304
Other,Manual,Per event,Check the correctness of the commission accounting,1252
Other,Manual,Per event,Verify compliance with the time limit set,2344
Other,Manual,Per event,Verify that documentation is consistent with practice,2766
Other,Manual,Per event,Check that all supplementary documentation is consistent with practice,760
Other,Manual,Per event,Verify the correct insertion of the documents in the procedure and their correctness,3407
Operational,Manual,Daily,Check and troubleshoot sending,330
Other,Semi-automatic,Per event,Verify correct receipt of information,2487
Other,Missing,Missing,Check the correct execution of customer instructions,1185
Operational,Manual,Per event,Carry out the fulfilments foreseen in terms of/AML/CTF or Countering the Financing of Terrorism,236
Other,Missing,Missing,Check the text and evaluate the documentation received,1678
Other,Semi-automatic,Per event,Check correct transfer deal,407
Other,Manual,Per event,Verify correctness of cancellation,2529
Other,Manual,Per event,Verify receipt of the request,2704
Other,Manual,Per event,Verify the correct payment,3431
Other,Manual,Per event,Verify the correctness of the unlocked amount,3797
Other,Manual,Per event,Verify correctness of blocked amount,2527
Other,Missing,Missing,Analyze the alerts highlighted in the system,63
Other,Missing,Missing,Check for abnormal operations,494
Other,Missing,Missing, Check for RFI responses,6
Other,Missing,Missing," Check for alerts in the ""to be escalated to case"" status",7
Other,Missing,Missing, Verify receipt of responses to the proposal for activating the Suspicious Transaction Reporting process,25
Other,Missing,Missing, Check for the presence of the first level Suspicious Transaction Report in the IAR,10
Other,Missing,Missing,Carry out the checks required during the execution of the contract,225
Other,Missing,Missing,Verify that contractor workers display identification cards,2763
Operational,Missing,Missing,Monitor for abnormal withdrawals,1913
Other,Manual,Per event,Check the payment of commissions to fv of the third guarantor,1529
Other,Manual,Per event,Verify the presence of the documentation certifying the approval of the third-party guarantor,3978
Other,Manual,Per event,Verify the consistency of the resolution with that of the Guarantee Fund,3132
Other,Manual,Per event,Verify the application data before sending,2950
Other,Manual,Per event,Check that the question has been entered correctly,839
Other,Manual,Monthly,Monitoring reports made to the Body,1979
Other,Manual,Per event,Verify the correctness of the communication to the Facilitating Body,3644
Other,Manual,Per event,Check for any additions,501
Other,Manual,Per event,Perform consistency checks,2005
Other,Manual,Per event,"Check that you have included all comments, if any",862
Operational,Missing,Missing,Check the relationship matrix,1588
Other,Missing,Missing,Verify completeness of the file,2314
Other,Missing,Missing,Check if the practice has generated the activation of the LIL or IL,656
Other,Missing,Missing,Check if the Compliance assessments have been carried out and if the case has generated the activation of the LIL or IL,652
Other,Manual,Annualy,Check feedback,486
Other,Manual,Annualy,Verify correspondence of the definitive pdf of the file,2551
Other,Manual,Per event,Check the English text of the Report,873
Other,Missing,Missing,Verify that the profiled customers in the medium or high risk range have been evaluated,2850
Other,Manual,Per event,Check the analyzes performed,938
Other,Manual,Per event,Verify the correct execution of the solely payments of principal and interest Test - SPPI Test and communicate the outcome to the Proponent,3375
Other,Manual,Per event,Check that the Tool for carrying out the SPPI Test present in the Credit Portal is correctly powered.,779
Other,Manual,Per event,Verify the correctness and completeness of the data entered in the Credit Portal,3537
Other,Manual,Per event,Verification of the correctness of the data entered for the calculation of the Gross Financial Debt / Ebitda ratio and of the correct compilation of the related PDC fields.,2185
Other,Manual,Monthly,Check the test results,1677
Operational,Missing,Missing,Check the need for early repayments of the provision.,1501
Other,Manual,Per event,Verify the correct accreditation to SACE,3175
Other,Semi-automatic,Per event,Check the first notes,1449
Other,Manual,Annualy,Check the correctness of the accounting,1243
Other,Manual,Annualy,Verify the correctness of the accrued interest,3597
Other,Manual,Annualy,Verify the consistency of data at Group level and report any misalignments found,3087
Other,Semi-automatic,Annualy,Check that the template has been sent to the Bank of Italy,854
Other,Manual,Annualy,Check the consistency of the contribution estimate,1098
Other,Semi-automatic,Annualy,Verify the sending of the declaration to the Bank of Italy,4011
Other,Manual,Annualy,Check the consistency of the entered data,1105
Other,Semi-automatic,Annualy,Check the correctness and completeness of the data entered,1223
Other,Manual,Annualy,Verify the correct adjustment of the items to be accounted for,3191
Other,Manual,Quarterly,Verify that the reliefs have been processed,2855
Other,Manual,Annualy,Verify the correctness of the accounting entry,3595
Other,Semi-automatic,Monthly,Verify the correct and complete entry of third-party entries,3218
Other,Semi-automatic,Monthly,"Verify the input data to the accounting systems, in relation to the income statement",3919
Other,Semi-automatic,Monthly,Verify the input data to the accounting systems relating to the balance sheets,3918
Other,Semi-automatic,Monthly,Verify the correct execution of the interventions,3372
Other,Semi-automatic,Monthly,Check for the presence of quadrator flows to be authorized or not received without justification,622
Other,Semi-automatic,Monthly,Verify that standard controls with KO results are justified,2774
Other,Semi-automatic,Monthly,Verify the correct and complete entry of the initiative income and balance sheet entries,3216
Other,Manual,Monthly,Verify the correct classification of the loss on the basis of the amount and carry out the checks envisaged for the authorisation,3274
Other,Manual,Monthly,Verify the correct and exhaustive periodic control activity,3237
Other,Manual,Per event,Verify the carrying out of the balancing activity,2978
Operational,Manual,Per event,Verify the correct draw operation in the application,3339
Operational,Manual,Per event,Correct insertion in the application of the request for loss,1783
Operational,Manual,Monthly,Verify the correct and complete execution of accounting entries,3219
Other,Manual,Annualy,Verify the correct loading of the budget data,3418
Professional,Manual,Monthly,Verify and reconcile balances,2262
Other,Manual,Quarterly,Check the perimeter of the companies,1534
Other,Manual,Monthly,Verify account balances,2213
Operational,Semi-automatic,Monthly,Validate the data entered and verify that the certification has taken place,2160
Other,Manual,Monthly,Verify the performance dynamics of the operating costs of the consolidated perimeter,3957
Other,Manual,Monthly,Verify the performance dynamics on the consolidated perimeter,3958
Other,Manual,Monthly,Verify the performance dynamics,3955
Other,Manual,Monthly,Verify that the spreadsheet and links are correct,2868
Other,Manual,Monthly,Check the performance data,1531
Professional,Manual,Monthly,Verify the performance dynamics of the Parent Company's operating costs,3956
Other,Manual,Monthly,Verify Segment Reporting balances,2205
Operational,Manual,Quarterly,Check the sending of the communication,1630
Professional,Manual,Monthly,Check that data is sent on time,763
Other,Manual,Per event,Verify partial enforcement validity and amount congruence,2655
Other,Manual,Per event,Check the validity of the total enforcement and the congruence of the amount,1708
Operational,Manual,Monthly,Verify the punctual sending of the communication to the SPV,3985
Professional,Manual,Monthly,Verify the timely sending of the communication,4032
Operational,Manual,Per event,Check the completeness of the documentation,1032
Operational,Manual,Per event,Verify compliance with the terms and correctness of the amount to be reimbursed communicated.,2342
Operational,Manual,Per event,Verify that the loan has been extinguished,2836
Operational,Manual,Half yearly,Verify the correctness of the refunded amount,3776
Other,Manual,Per event,Verify Processing,2202
Other,Manual,Per event,Check calculations for Central Asset Net Interest,360
Other,Manual,Monthly,Verification of calculations of unsustainable indicators,2176
Other,Manual,Monthly,Verify the correct calculation of the indicators,3259
Other,Missing,Missing,Verify the information submitted electronically,3917
Operational,Manual,Per event,Check the amounts to be settled and make payments,937
Professional,Semi-automatic,Monthly,Verify in the passive cycle the consistency between availability and committed and final balance,2623
Other,Semi-automatic,Monthly,Check the consistency of the estimates,1108
Other,Manual,Per event,Verify the consistency and correctness of the data in the system.,3079
Other,Manual,Per event,Verify the consistency and correctness of the trade in the system,3080
Operational,Manual,Per event,Check the completeness of the form,1040
Other,Manual,Daily,Check the correctness of the entered data,1275
Other,Manual,Per event,Check the transaction data,1681
Other,Manual,Missing, Check again that the IB&SF manager's consent has been acquired for the application of the commission not in line with the CME Commission Tables,5
Other,Manual,Missing, Check that the consent has been acquired by the IB&SF manager for the application of the commission not in line with the ECM Commission Tables,13
Operational,Manual,Per event,Fulfill the fulfilments foreseen for AML/CTF or Countering the Financing of Terrorism,1840
Operational,Manual,Per event,Carry out AML/CTF or Counter Terrorism Financing checks,114
Other,Missing,Missing,Tick what is authorized,2140
Other,Missing,Missing,Activity Tick off what is authorised,36
Other,Semi-automatic,Per event,Check correct update on applications,408
Other,Manual,Per event,Certify the correctness of the level of fair value and day one profit determined,264
Other,Manual,Monthly,Check the selected price,1626
Other,Manual,Monthly,Check authorization and correctness of the assessment,344
Other,Manual,Monthly,Check the correctness and completeness of the data entered,1223
Other,Semi-automatic,Monthly,Check the correctness and completeness of the data entered,1223
Other,Manual,Monthly,Verify attribution of stress parameters,2279
Other,Manual,Monthly,Check the correctness of processing,1238
Other,Semi-automatic,Monthly,Verify the correctness of the Credit Risk Adjustment calculation,3578
Other,Automatic,Monthly,Check the completeness and consistency of the data entered,994
Other,Manual,Monthly,Verify receipt of all available Trustee Reports,2692
Other,Manual,Monthly,Check the consistency of the prices obtained,1118
Other,Manual,Monthly,Verify the correct insertion of the unwinding operations,3410
Other,Manual,Monthly,Verify the correct update,3497
Other,Manual,Monthly,Verify the correct update of the Front Office system,3498
Other,Manual,Quarterly,Carry out capacity checks,137
Other,Missing,Missing,Verify contracts and acquired documentation,2385
Other,Missing,Missing,Check acquisition of messages by the Bank of Italy.,310
Other,Missing,Missing,Evaluate and validate the request for authorization to access restricted areas,1807
Other,Manual,Per event,Check the record date,1574
Operational,Manual,Half yearly,Check the correspondence between the offer and what is entered in the applications,1316
Other,Missing,Missing,Check for the presence of the weapons code,627
Other,Missing,Missing,"Verify the consistency, completeness of information and compliance of the transaction",3138
Other,Missing,Missing,"Check the consistency, the completeness of the information",1130
Other,Automatic,Daily,Check outstanding SDD debit provisions,704
Other,Semi-automatic,Monthly,Check for unopted assets,633
Other,Manual,Per event,Verify the closing of the financial plan of the asset and of the contract,2985
Other,Semi-automatic,Monthly,Check list of items with blocked redemption value charge,675
Other,Manual,Per event,Verify the correct confirmation of the Resolution,3308
Other,Manual,Per event,Verify the completeness of the documentation acquired by the proponent,3046
Other,Manual,Per event,Verify the correct fulfillment of the Regulatory Obligations and the presence of all the required Opinions,3387
Other,Missing,Missing,Check the outcome of the collection orders,1520
Other,Manual,Per event,Collect authorization signatures,1749
Other,Manual,Per event,Collect signatures,1751
Other,Manual,Per event,Check the documentation and enter the receipt,1396
Other,Missing,Missing,Verify the absence of Investment Proposals/Instructions for the client to be reported,2910
Other,Missing,Missing,Check for any pending updates,532
Other,Manual,Per event,Verify the correct insertion of the guarantee in the systems,3408
Other,Manual,Per event,Check and validate the entries in the position keeping system for sending to Accounting,337
Other,Semi-automatic,Per event,Verify the correctness of inserting the New Deal,3573
Other,Manual,Per event,Check and validate the entries in the position keeping system,336
Other,Semi-automatic,Per event,Verify correctness of inserting the New Deal,2533
Other,Manual,Per event,Validate operation on the BO system for sending to accounting,2151
Other,Manual,Per event,Verify correctness of the reversal,2546
Professional,Manual,Monthly,Verification of owned metal in stock,2180
Other,Manual,Daily,Verify the materiality of the owned metal,3926
Professional,Manual,Per event,Third party metal verification,2125
Other,Missing,Missing,Check the invoices not pertaining to it,1472
Other,Manual,Per event,Check the sorting of invoices to the corporate subsystems,1644
Other,Missing,Missing,Check addressing to destination applications,312
Other,Semi-automatic,Daily,Check the accounting proposal,896
Other,Semi-automatic,Per event,Check the wire transfer proposal,1717
Other,Semi-automatic,Daily,Check if there are any unsuccessful transfers,659
Other,Semi-automatic,Daily,Verify the correct confluence of the document in the wf circuit,3309
Other,Semi-automatic,Daily,Verify the complete loading of the documents in the WF,3006
Other,Semi-automatic,Daily,Verify registrability and conformity of supplier invoices,2711
Other,Manual,Per event,Check the manual payment,1492
Other,Manual,Per event,Check accounting,305
Other,Semi-automatic,Per event,Verify payment authorization,2657
Other,Missing,Missing,Verify the correctness of the values produced the previous day,3805
Other,Automatic,Daily,Verify the correctness of the calculation of the Comit Index,3625
Other,Manual,Per event,Check for any alerts automatically generated by the management application following verification of the validity of the prices provided by the InfoProviders and to report unsent values,502
Other,Semi-automatic,Per event,Verify the corrections of the structures / companies of the Group,3524
Other,Semi-automatic,Half yearly,Check the correct compilation of the forms,1175
Other,Manual,Half yearly,Verify the complete fulfillment of the reliefs,3005
Other,Semi-automatic,Half yearly,Examine the diagnostic result,1833
Other,Semi-automatic,Half yearly,Run the diagnostic procedure at the original scenario level and verify its outcome,2094
Other,Manual,Half yearly,Carry out a trend analysis of the data,127
Operational,Manual,Per event,Check sending and acceptances,744
Other,Manual,Per event,Verify the reconciliation and make the appropriate adjustments,3995
Other,Manual,Daily,Verify the correct creation and/or updating of the event,3315
Other,Manual,Per event,Verify reconciliation and make appropriate adjustments,2707
Other,Manual,Daily,Check if the event was created or updated correctly,654
Other,Manual,Annualy,Check that the Committees have been convened,770
Other,Manual,Weekly,Check the machining of the positions,1490
Other,Manual,Daily,Define funding or employment amounts,1786
Other,Manual,Per event,Verify data correspondence,2562
Other,Manual,Per event,Verify that the calculated and paid value corresponds,2787
Other,Manual,Per event,Verify correctness of payment,2538
Professional,Manual,Per event,Check that the amount of the bank transfer received relating to the assignment of credits corresponds to the contractual agreements signed.,785
Other,Manual,Per event,Verify that the differences have been accounted for,2820
Professional,Manual,Per event,Verify correctness of the Information,2542
Other,Manual,Per event,Verify the completeness and correctness of the activities performed,3015
Operational,Manual,Per event,Verify completeness and timeliness of subscriptions,2306
Operational,Manual,Per event,Check the correctness and completeness of the documentation,1225
Professional,Manual,Per event,Formal and substantial verification of the model,1839
Operational,Manual,Per event,Check by another employee of the facility,355
Other,Missing,Missing,Verify the completeness of the documentation certifying the exceeding of the Lending Limit,3047
Other,Missing,Missing,Verify correct update procedure,2507
