controlCategory,controlType,controLPeriodocityEnglish,control,controlID
Other,Manual,Quarterly,"Sharing the correct assessment of the ""non-performing/unlikely to pay"" conditions with the relevant Manager",2100
Other,Manual,Quarterly,Verify perimeter completeness,2658
Other,Manual,Quarterly,Check the consistency of the data entered in the application,1100
Other,Manual,Half yearly,Verify the correspondence of the book value of the investments,3826
Other,Manual,Annualy,Verify consistency/completeness of assessment sets,2383
Other,Manual,Quarterly,Check that the data matches,809
Other,Manual,Quarterly,Verify consistency and reasonableness of the evaluation and issue the validation,2362
Other,Manual,Quarterly,Verify receipt of all evaluations,2693
Other,Manual,Half yearly,Check for the presence of trigger events,628
Other,Manual,Per event,Verify the correct accounting adjustment,3147
Other,Manual,Per event,Verify the possible lack of accounting correction,3964
Other,Manual,Per event,Check the positions subject to correction,1537
Other,Manual,Per event,Verify correct insertion of the resolution,2472
Other,Manual,Per event,Verify the completeness and correctness of the data and information,3018
Other,Manual,Per event,Verify the correct integration of data into the system,3412
Other,Manual,Per event,Verify the post-application data of the pro-formas,3965
Other,Manual,Per event,Check that the data is fed correctly,808
Other,Missing,Missing,Verify the information,3912
Other,Missing,Missing,Verify the correctness of the identified operations,3725
Other,Manual,Per event,Verify that the documentation actually represents the regularization of the risk event,2821
Other,Manual,Per event,Check the completeness of the documentation,1032
Other,Manual,Per event,Verify the correct accounting of the Confidi Guarantee and the Counter-guarantee,3154
Other,Manual,Per event,Check the completeness of the warranty documentation,1058
Operational,Missing,Missing,Verify the consistency between position and company requirement,3083
Operational,Manual,Monthly,Verify the perimeter of the assets to be valued,3962
Operational,Manual,Per event,Verify the perimeter of the assets to be valued,3962
Professional,Manual,Monthly,Check feedback on the evaluation of the positions indicated in the report,487
Operational,Manual,Per event,Check the valuation update of the goods,1712
Other,Missing,Missing,Verify the correctness of the request,3780
Other,Manual,Daily,Identify and analyze capacity anomalies and related problem tracking,1842
Other,Manual,Per event,Analyze the management of Problem-Tasks in a timely and appropriate manner,72
Other,Manual,Daily,Perform balancing of proxies,1998
Other,Missing,Missing,Check the amount of outgoing wire transfers,931
Other,Manual,Daily,Verify accommodation suspended,2212
Other,Manual,Daily,Squaring sent messages,2105
Other,Manual,Daily,Balancing unpaid messages,106
Other,Manual,Per event,Verify that the covered bonds have been extinguished,2804
Other,Manual,Per event,Verify correct downloading of documents,2444
Operational,Manual,Per event,Check the signature powers/specimens of the FO structure and the Counterparty,1638
Other,Manual,Monthly,Tick interest reports and fee reports,2132
Other,Semi-automatic,Half yearly,Check enabled users,477
Other,Semi-automatic,Daily,Communicate the suspended,1754
Other,Missing,Missing,Check data consistency,434
Other,Semi-automatic,Quarterly,Check for correct processing,555
Other,Semi-automatic,Quarterly,Check the BankIt diagnostic preview,867
Other,Manual,Per event,Verify the correct certification of the pricing,3271
Other,Manual,Per event,Verify that correct amounts have been posted,2764
Operational,Manual,Per event,Verify accounted data,2214
Other,Manual,Per event,Verify the correct valuation of the amounts,3517
Other,Manual,Per event,Verify the completion of the guarantees,3060
Other,Semi-automatic,Per event,Verify the exact split of the original loan amount,3877
Other,Manual,Per event,Verify the correct registration of the document,3464
Other,Automatic,Per event,Check for the existence of FATCA documentation,610
Other,Manual,Per event,Check document deadlines,459
Other,Manual,Monthly,Verify emails,2589
Other,Semi-automatic,Daily,Check SISBA key processing results,292
Other,Semi-automatic,Monthly,Verify correct and complete system power supply,2414
Other,Manual,Monthly,Check the results of the tests,1620
Other,Semi-automatic,Quarterly,Verify correct sending of the supplementary flow of the consolidated TdE outcome,2493
Other,Semi-automatic,Quarterly,Verify correct sending of master data flow for consolidated financial statements,2492
Other,Semi-automatic,Daily,Check the correctness of the daily processing,1258
Other,Manual,Monthly,Check the calculation result,959
Other,Semi-automatic,Monthly,Verify that individual TdE flow has been successfully sent,2769
Other,Manual,Monthly,Check the result of the calculation at a consolidated level,1614
Other,Manual,Monthly,Verify correct accounting of the results of the efficacy test,2399
Other,Manual,Per event,Verify the correct completion of the repayment plan,3298
Other,Manual,Per event,Verify the correct completion of the transaction,3300
Other,Semi-automatic,Per event,Verify the correct implementation of the Modify Security,3397
Other,Manual,Per event,Check update done,1725
Other,Manual,Per event,Check for anomalies,496
Other,Manual,Per event,Check the data entered in the accounting system,1347
Other,Manual,Per event,Verify the correctness of the payment prepared,3755
Other,Manual,Per event,Carry out compliance checks,166
Other,Other,N.A.,Check the completeness and regularity of the documents representing the guarantee,1018
Other,Manual,Per event,Check the operation,1509
Operational,Manual,Per event,Verify instant credit transfers,2626
Other,Missing,Missing,Verify the correct census of practices,3266
Other,Manual,Monthly,Identify the positions without a value adjustment resolution,1847
Other,Manual,Per event,Verify the proposed resolution out of autonomy,3984
Other,Manual,Per event,Verify the approach used (going/gone concern),2952
Other,Manual,Per event, Check if the subject is authorized to carry out the resolution,11
Other,Manual,Per event,Check the completeness/update of the collected documentation,1062
Other,Manual,Per event,Verify the correct discharge of the guarantee from the systems,3336
Other,Manual,Per event,Verify the completeness of the documentation of the Credit Proposal,3048
Other,Manual,Per event,Verify the correct execution of the solely payments of principal end interest Test - SPPI Test and communicate the result to the Proponent,3376
Other,Manual,Per event,Verify the exact reclassification of the financial statements,3876
Other,Manual,Per event,Verify receipt of all necessary admissibility opinions.,2697
Other,Manual,Per event,Check the calculation of the Competency,952
Professional,Manual,Per event,Verify that you have correctly fulfilled the necessary Regulatory Obligations and requested the required opinions.,2889
Other,Manual,Per event,Check the activities performed by the Assistant,903
Other,Manual,Per event,Check interventions carried out on the system,671
Other,Manual,Per event,Verify the correctness and completeness of the submitted documentation,3559
Other,Manual,Per event,Verify the correctness and completeness of the documentation on the representatives of the Subsidiary Banks,3545
Other,Manual,Half yearly,Verify the correctness and completeness of the documentation prepared,3546
Other,Manual,Per event,Verify the consistency of the information uploaded with the documentation prepared,3119
Other,Manual,Monthly,Check the mailing of the list,1491
Other,Manual,Per event,Verify the correct update of the archives,3499
Other,Missing,Missing,Evaluate the non-ordinary access request,1818
Other,Missing,Missing,Review documentation and produce new employee badge,2087
Other,Missing,Missing,Verify the customer's requirement regarding US and Cuban citizenship,3834
Other,Missing,Missing,Verify the correctness of the registry census,3777
Operational,Other,N.A.,Validate analysis on new agreement,2147
Operational,Missing,Missing,Verify that you have correctly classified all cyber relevant Third Parties,2887
Other,Semi-automatic,Per event,Check,273
Operational,Manual,Daily,Verify correct attribution of the position,2419
Operational,Manual,Daily,Check consistency of results in the tools,388
Other,Manual,Per event,Verify the correct accounting of the security deposit,3173
Other,Manual,Per event,Verify the consistency of the economic offer with respect to the terms of the resolution,3114
Other,Manual,Per event,Verify that the causes of the problem have been identified,2790
Other,Automatic,Per event,Check the recovery note documentation for the Major Incident,1577
Other,Manual,Per event,Verify correct memorization of the resolution,2482
Other,Manual,Per event,Check that the necessary clauses have been inserted correctly in the contractual draft,831
Other,Manual,Per event,Verify the consistency of the contract and of the documentation prepared with the resolution,3108
Other,Manual,Per event,Carry out pre-delivery checks,200
Other,Manual,Per event,Verify the presence of all the data and signatures required in the Warranty Certification Form,3970
Other,Missing,Missing,Verify the completeness of the identified perimeter,3049
Other,Missing,Missing,Check the correctness and completeness of the entries,1226
Other,Manual,Annualy,Evaluate the adequacy of the reports received and analyze the gaps and differences,1813
Other,Manual,Annualy,Verify the completeness and correctness of the information entered in the Italian national documentation and Masterfile,3023
Other,Manual,Per event,Check the correctness/completeness of the data entered,1306
Other,Manual,Per event,Check the correctness / completeness of the data entered,1218
Other,Manual,Per event,Check reports relating to pledges,737
Other,Manual,Per event,Check the reports of transactions other than the pledge,1601
Other,Manual,Per event,Check the correctness and completeness of the data entered,1223
Other,Manual,Per event,Check the reports,1600
Other,Semi-automatic,Monthly,Check for receivables with non-validated fair value prices/levels,593
Professional,Semi-automatic,Monthly,Verify acquisition of prices from infoproviders,2229
Other,Semi-automatic,Monthly,Verify the correct and complete loading of prices and fair value levels,3222
Other,Semi-automatic,Monthly,Verify the correctness of the prices and fair value levels of receivables valued at fair value,3767
Other,Semi-automatic,Monthly,Verify the complete sending of the data,3008
Professional,Semi-automatic,Monthly,Verify complete data reception,2299
Other,Manual,Per event,Verify that the required interventions have all been completed,2861
Other,Manual,Per event,Verify correct certification,2427
Other,Manual,Per event,Check correct execution of the drains.,400
Other,Manual,Per event,Verify the accuracy of the data in the reports and NDGs being transferred,2931
Other,Manual,Per event,Verify receipts reversal to Kerma,2705
Professional,Manual,Per event,Check the settled sums,1634
Other,Manual,Per event,Verify the correctness of the personal data notes,3758
Other,Manual,Monthly,Carry out the migration account reset control activities,239
Other,Manual,Per event,Verify accounting for losses/gains on disposal,2223
Other,Manual,Per event,Check for errors in the perimeter of the NDGs in the quarterly assignment,567
Operational,Manual,Per event,Check closure of funds,367
Operational,Missing,Missing,Verify that you have implemented the update by all suppliers subject to monitoring,2892
Operational,Manual,Per event,Check what the customer signed,1733
Operational,Missing,Missing,Check and update the exception list,331
Other,Missing,Missing,Verify the consistency of data between different environments,3088
Other,Missing,Missing,Analyze monthly reporting ORM files,56
Other,Missing,Missing,Analyze scraps and make adjustments,62
Other,Manual,Monthly,Check 'Leveraged Transaction' labeling,274
Other,Manual,Daily,Proceed with data verification and reconciliation,2031
Other,Manual,Monthly,Verify system change completion by the last day of the month,2745
Other,Semi-automatic,Annualy,Carry out the formal check,229
Other,Manual,Half yearly,Check the completeness of the contributions received,1028
Other,Manual,Quarterly,Conduct consistency analysis,1771
Other,Manual,Half yearly,Verify the correct determination of the value of the funds,3333
Other,Manual,Quarterly,Verify the correctness of the prepared files,3763
Other,Manual,Monthly,Verify the correct and complete accounting recognition of the settlement entries relating to the funds area,3200
Other,Manual,Annualy,Perform correctness checks,2007
Other,Manual,Quarterly,Verify the correctness of the calculations made,3636
Other,Manual,Annualy,Check the MAV relating to FIRR payments,880
Other,Manual,Quarterly,Check the MAV relating to Enasarco payments,879
Other,Manual,Per event,Verify the correctness of the invoice and the Enasarco ceiling threshold,3740
Other,Manual,Half yearly,Check the calculation of the six-month transaction,956
Other,Missing,Missing,Check the remaining certificates in load,1591
Professional,Manual,Monthly,Verify robustness of model outputs,2725
Professional,Semi-automatic,Monthly,Verify the correct acquisition of information,3176
Professional,Manual,Monthly,Perform consistency checks,2005
Professional,Semi-automatic,Monthly,Verify the correct incorporation of the data into the anticipation model,3405
Professional,Semi-automatic,Monthly,Verify the presence of any methodological discontinuities in the reporting criteria of the phenomena and related impacts,3971
Professional,Manual,Quarterly,Verify the presence of discontinuities in the scope of consolidation and related impacts,3972
Professional,Manual,Monthly,Check consistency and correctness of the representation,380
Professional,Manual,Per event,Check consistency and correctness of the representation,380
Other,Other,N.A.,Check the coupon and redemption schedule,1331
Other,Other,N.A.,Check customer credit letters,423
Other,Other,N.A.,Verify the tax amount,4029
Other,Other,N.A.,Check the correctness of the payments,1290
Other,Other,N.A.,Verify correct accounting,2390
Other,Other,N.A.,Verify the balancing of roles,2966
Other,Other,N.A.,Check balances of various open items,348
Other,Other,N.A.,Check the switchboards mod. 770 of relevance,1670
Other,Other,N.A.,Verify the flow of recipients,3893
Other,Other,N.A.,Check the sending of the certificates,1629
Other,Other,N.A.,Verify the correctness of the roles worked and relative accounting,3786
Other,Other,N.A.,Check event rejects or recoveries,483
Other,Other,N.A.,Verify the correctness of the protocols received,3769
Other,Other,N.A.,Check the depositary's credits,1385
Other,Manual,Per event,Verify extracted data,2610
Other,Manual,Daily,Analyze the variations and check the performance trend,80
Other,Manual,Per event,Analyze the variations and check the performance trend,80
Other,Manual,Daily,Verify extracted data,2610
Other,Manual,Daily,Check the open PVs on the One Shots,1508
Other,Manual,Per event,Verify the consistency of the NAV value of the Fund and register it in the system,3097
Operational,Manual,Per event,Validate the operation in the system,2166
Other,Manual,Per event,Check the transaction data entered in the system,1682
Operational,Manual,Per event,Check the commitment data entered in the system,980
Other,Missing,Missing,Verify compliance with occupational safety measures,2323
Other,Missing,Missing,Check for updates,636
Other,Manual,Per event,Check the exact assignment,1427
Other,Manual,Per event,Verify the exclusivity of the manager,3878
Operational,Manual,Monthly,Verify the performance of the checks on the document sheet,3960
Other,Semi-automatic,Monthly,Verify correct sending of letters to debtors,2491
Other,Manual,Per event,Verify loss report,2632
Other,Manual,Per event,Verify correctness and completeness of documents,2517
Professional,Manual,Monthly,Check evaluation timing,482
Professional,Manual,Monthly,Verify the timeliness of taking charge of the practices by the debt collection structures,4031
Professional,Manual,Monthly,Check completeness of documentation,373
Other,Missing,Missing,Approve registry changes,86
Other,Semi-automatic,Monthly,Check the presence and status of subsidized loans,1540
Other,Manual,Weekly,Monitor the timing of the practices in the process of being approved,1973
Other,Manual,Per event,Check the correct entry of the fund request,1183
Other,Manual,Per event,Verify the correct determination of the contribution,3327
Other,Manual,Per event,Ensure correct forwarding of the resolution to the Body,1796
Other,Manual,Per event,Verify the consistency of the contribution disbursed,3109
Professional,Automatic,Per event,Check the valorisation of the fields necessary for the classification of a report in the non-finance area,1709
Other,Automatic,Per event,Verify that the mandatory information is entered when opening and closing the incident,2838
Other,Manual,Per event,Check the documentation functional to the legal investigation,1399
Other,Manual,Per event,Check the contractual draft,1144
Other,Manual,Daily,Check the status of the different activities,1655
Other,Semi-automatic,Daily,Verify overrun of the treasury limit set for each bank,2652
Other,Semi-automatic,Daily,Check coverage limit breaches per customer,415
Other,Semi-automatic,Daily,Verify non-compete accounting,2642
Other,Semi-automatic,Daily,Verify operator error for entering data with contradictory verification,2649
Other,Semi-automatic,Daily,Verify operator error for incorrect allocation to the income statement,2650
Operational,Other,N.A.,Verify the correctness of the inserted plan,3735
Operational,Other,N.A.,Check the correspondence of the resolution data on the system,1328
Other,Other,N.A.," Verify the activities carried out for the non-payment, for the correct payment under guarantee and for the correct accounting of payments and the passage to loss",27
Other,Other,N.A., Verify the correct accounting of the distribution of the collection and of the passages to loss,29
Operational,Other,N.A.,Verify correctness of the proposal,2545
Other,Other,N.A.,Check the interest invoice issued,1468
Other,Manual,Quarterly,Investigate uncompleted rehearsals,1856
Other,Semi-automatic,Per event,Check the completeness and correctness of the list of assets to be redeployed,1012
Other,Manual,Quarterly,Verify the completeness in the activation of all re-examination requests.,3039
Other,Manual,Quarterly,Verify the closure of all detected re-examination requests,2987
Other,Manual,Annualy,Verify the correct determination of any goodwill impairment recognized,3324
Other,Manual,Annualy,Check the correctness of the calculation,1249
Other,Manual,Quarterly,Verify the correct determination of the discount rate and the growth rate,3329
Other,Manual,Quarterly,Verify the correct compilation of the Note for the Board of Directors,3287
Other,Manual,Annualy,Verify the correct compilation of the Explanatory Notes for the parts concerning the impairment test of goodwill,3284
Other,Manual,Annualy,Check the calculation,950
Other,Manual,Quarterly,Verify the correct update of the discount rate and the growth rate,3501
Other,Manual,Per event,Check that the position is correctly updated in the application,837
Other,Manual,Per event,Verify that the certificate of guarantee is consistent with the loan and the intended guarantee,2794
Other,Manual,Per event,Check the capacity limits,960
Other,Manual,Per event,Verify consistency and completeness of data,2360
Other,Semi-automatic,Per event,Verify proper alignment of systems,2673
Other,Manual,Per event,Validate the operation entered manually,2165
Other,Missing,Missing,Check for any information mismatches,525
Other,Other,N.A.,Verify the correctness and completeness of the data,3535
Other,Other,N.A.,Check the correctness of the data and authorize the request,1260
Other,Manual,Per event,Verify the correct updating of the relevant application with reference to the registration of the execution of the bank transfer on the basis of the communication received from Mutui Privati.,3509
Other,Manual,Per event,Verify the correct classification of the customer's risk status,3273
Other,Manual,Per event,Check the correctness of the calculation of the amount to be returned,1250
Other,Manual,Per event,Verify the correct accounting of the exposure in the system.,3165
Other,Manual,Per event,Verify the correct accounting of the exposure decount in the system.,3164
Other,Manual,Per event,Verify the correctness of the amount reported in the credit certificate.,3606
Other,Manual,Per event,Verify the correct registration of the resolution in the system and of the amounts to be received/returned from/to the FdG following any cross-examination in order to correctly direct subsequent activities,3471
Other,Manual,Per event,Verify the correctness of the activation as a deposit of the guarantee,3600
Other,Manual,Per event,Verify the correctness of the application for definitive loss settlement,3613
Other,Manual,Per event,Verify the correctness of the amount reported in the credit certificate,3605
Other,Manual,Per event,Verify the correct valorisation of the data of the Fund's resolution relating to the outcome of the enforcement in the pertinent application.,3516
Other,Manual,Per event,Verify the correct loading of the information relating to the amount of the exposure reported in the documentation received from the Manager.,3421
Professional,Manual,Per event,Verify the correct determination of the Deliberating Body,3325
Other,Manual,Per event,Check the completeness of the archived documentation,1025
Other,Manual,Per event,Verify draft contracts used in the stipulation phase,2582
Other,Manual,Per event,Verify the authorization to supply S.A.L.,2958
Other,Missing,Missing,Check the regular confirmation of the transactions entered,1582
Operational,Manual,Per event,Verify the proposal to switch at loss,3982
Operational,Manual,Per event,Verify entry into system,2593
Other,Missing,Missing,Promptly verify reports of anomalies,2036
Other,Missing,Missing,Verify the correct reception of the reply e-mails,3457
Other,Missing,Missing,Ensure timely referral of suspected cases to branch offices,1801
Other,Missing,Missing,Make sure of the authenticity of the documents,1868
Other,Manual,Quarterly,Verify reports received and accuracy / completeness inventory commitments,2720
Other,Manual,Quarterly,Verify the correctness of the companies in the system,3646
Other,Manual,Quarterly,Check the correspondence of the data between the quarterly termplate and the data present in the investment application,1321
Other,Manual,Quarterly,Check the correspondence of the data between the Budget application and the investment file,1320
Other,Semi-automatic,Quarterly,Verify the correctness of the full consolidation method defined in the procedure,3723
Other,Manual,Quarterly,Verify the correct sending of the streams,3481
Other,Manual,Quarterly,Check for any rejects and any inconsistent data,536
Other,Manual,Quarterly,Check exposure data,485
Other,Manual,Quarterly,Verify the data and certify the database,3836
Other,Semi-automatic,Quarterly,Verify the correct and complete data processing,3214
Other,Manual,Quarterly,Verify the correct and complete preparation of the flow of excerpts,3226
Other,Manual,Monthly,Verify the consistency of the extraction performed,3116
Other,Manual,Quarterly,Analyze the output of the calculation,75
Other,Manual,Quarterly,Check for any errors,518
Other,Manual,Quarterly,Check the correct and complete update of the parameters,1163
Other,Manual,Quarterly,Check the correctness of the data,1259
Other,Manual,Quarterly,Carry out exposure controls,175
Other,Manual,Quarterly,Verify the completeness and correctness of the extraction performed,3022
Other,Semi-automatic,Quarterly,Verify the correct and complete acquisition of the flows,3201
Other,Semi-automatic,Quarterly,Verify the correct and complete acquisition of the reconciled data,3202
Other,Manual,Quarterly,Check the warranty data,1716
Other,Semi-automatic,Quarterly,Verify the correct sending of flows relating to master data / segmentation / rating,3475
Other,Missing,Missing,Verify the integrity of the branch perimeter,3921
Other,Missing,Missing,Carry out a preventive inspection of the Branch premises,123
Other,Manual,Per event,Check information document,667
Other,Manual,Per event,Verify the contents of the communication,3141
Other,Manual,Per event,Check the contents of the information document,1137
Other,Manual,Per event,Check the information document with the content of the resolution,1459
Other,Manual,Per event,Verify that the transaction has been correctly identified and traced back to the reference case,2874
Other,Manual,Per event,Verify the correctness of the financial information contained in the document only if certification by the Financial Reporting Officer is required,3718
Other,Manual,Per event,Verify accumulation of transactions of lesser significance,2226
Other,Manual,Weekly,Analyze logs of nightly processing,54
Other,Manual,Per event,Authorize currency trading,98
Other,Manual,Per event,Locate squaring and insert adjustment writing,1862
Other,Manual,Daily,Verify account balances,2213
Other,Semi-automatic,Daily,Check calculation of deferred income,357
Other,Manual,Per event,Identify squaring,1846
Other,Semi-automatic,Per event,Check and report the new unconnected keys,329
Other,Semi-automatic,Daily,Check the net exposure in foreign currency,1503
Other,Manual,Monthly,Check that the upload data has been processed correctly,858
Other,Manual,Per event,Verify consistency of impacts,2378
Other,Missing,Missing,Verify the validity of the lists of data processors and data controllers,4038
