riskGUID,risk,riskID
073e4a61-faa6-11eb-60ce-001dd8b72a56,Wrong or missing CUA accounting,3128
4da5933d-3302-11eb-275f-001dd8b72a50,Incorrect accounting,1078
7b054d52-2e05-11e9-2249-001dd8b721ea,Incorrect labelling,1665
7bc3dbe3-913f-11e7-2249-001dd8b721ea,Incorrect/incomplete entry of data into the system,2081
e71f0665-8ee3-11e7-2249-001dd8b721ea,Incorrect or incomplete entry of data into the system,1766
463ed09e-9137-11e7-2249-001dd8b721ea,Incorrect and/or inconsistent information for evaluation,1231
03b3fae0-4045-11eb-60ce-001dd8b72a56,Incorrect or incomplete data integration,1758
55b19eb1-404f-11eb-60ce-001dd8b72a56, Incorrect data after application of the pro-forma,19
03b3fae9-4045-11eb-60ce-001dd8b72a56,Incorrect data for the production of reports,1446
18f4ca70-a3d8-11e9-6ab0-001dd8b72a56,Non-compliance of the data entered with respect to the contractual conditions,2365
50050af5-d8da-11eb-60ce-001dd8b72a56,Incorrect data,1413
59c7dd08-d8db-11eb-60ce-001dd8b72a56,Incorrect data,1413
bb04fa7a-e830-11e8-2249-001dd8b721ea,Incorrect and/or incomplete documentation,1203
05cf6489-85e6-11e8-2249-001dd8b721ea,Incorrect and/or incomplete documentation,1203
cdd19aa0-fe1e-11e8-2249-001dd8b721ea,Incorrect accounting of the counter-guarantee,1118
078acfbd-85e6-11e8-2249-001dd8b721ea,Incorrect fulfillment of the guarantee,1620
42f59fc5-b721-11ec-275f-001dd8b72a50,Activation of an inappropriate internal selection process,86
e253c692-601d-11e9-2249-001dd8b721ea,Wrong definition of assets valuation perimeter,3042
e253c6a0-601d-11e9-2249-001dd8b721ea,Wrong definition of assets valuation perimeter,3042
04f0faea-fa42-11ec-43a8-001dd8b72a55, RDV adjustment delays within the required timescales,43
b93aefe1-498b-11e9-2249-001dd8b721ea,Failure to update asset valuation,684
006e39d1-b676-11e8-2249-001dd8b721ea,Approval of an incorrect request,126
8e72f065-e968-11eb-60ce-001dd8b72a56,Wrong acquisition of contracts/documentation,2940
3be87eaa-c9dd-11eb-275f-001dd8b72a50,Incorrect accounting of the operation,1128
01ebf771-4d1b-11ec-60ce-001dd8b72a56,Failure to produce the transfer agreement,624
94628539-1194-11ed-2a4f-001dd8b72a55,Failure to identify anomalies/corrective activities with respect to the Baseline in the context of the use of resources,574
9462853c-1194-11ed-2a4f-001dd8b72a55,Failure to resolve problems (or associated P-Tasks) adequately.,656
9387b7cc-8c10-11e7-2249-001dd8b721ea,Squaring between proxies received and uploaded to the system,2789
9387b7c9-8c10-11e7-2249-001dd8b721ea,Squaring between the amount collected and paid,2790
4225711c-c6d0-11ec-60ce-001dd8b72a56,Unsettled accounting suspension,2881
19728162-c6ce-11ec-60ce-001dd8b72a56,Squaring sent messages,2796
3b7ab146-c6cb-11ec-60ce-001dd8b72a56,Received message squaring,2638
c8cff4a5-92e4-11e7-2249-001dd8b721ea,Covered bonds not settled,242
3999ecd7-c913-11e7-2249-001dd8b721ea,Wrong accounting discharge guarantee,2936
3999ece1-c913-11e7-2249-001dd8b721ea,Incorrect download of documents,1517
5f6e84f6-7f81-11ec-43a8-001dd8b72a55,Signature powers/specimen incorrect,2782
d437b805-0275-11e7-2688-00101818ed80,Incorrect counterparty evidence,1399
d437b809-0275-11e7-2688-00101818ed80,Validation of fees and interests by unauthorized personnel,2894
d437b801-0275-11e7-2688-00101818ed80,Presence of pending positions,2574
aa5b2642-b8d3-11e7-2249-001dd8b721ea,Inconsistent census data,986
2e5d2607-c7d8-11e8-2249-001dd8b721ea_TRA1,Operation not permitted,2426
2e5d2607-c7d8-11e8-2249-001dd8b721ea_TRA2,Operation not permitted,2426
9e8fde92-ffab-11e9-4b37-001dd8b72a50,Incorrect data,1413
202a8856-b791-11e9-4b37-001dd8b72a50,Inconsistent and/or inconsistent data,982
4e355552-1d87-11ea-4b37-001dd8b72a50,Wrong / failure to send the report,2915
202a885f-b791-11e9-4b37-001dd8b72a50,Outdated and/or incorrect data,2442
69615e6c-ca3f-11e9-4b37-001dd8b72a50,Incorrect templates,1993
fcf92610-7bf6-11eb-60ce-001dd8b72a56,Error / no census,360
995cf300-0a02-11eb-43a8-001dd8b72a55,Pricing not compliant with the rules,2605
8e25eb80-254e-11ed-7f82-001dd8b72a50,Incorrect data,1413
c79c2dad-93e3-11e7-2249-001dd8b721ea,Incorrect title adjustment,1996
1b4bd3b1-ed7a-11ec-275f-001dd8b72a50,Incorrect Income Statement posting,1056
285d94c5-d106-11e7-2249-001dd8b721ea,Incorrect data entry,1428
1b4bd3dd-ed7a-11ec-275f-001dd8b72a50,Incorrect accounting,1078
8e2687c2-254e-11ed-7f82-001dd8b72a50,Incorrect data,1413
eb619f31-fc31-11e7-2249-001dd8b721ea,Incorrect data entry,1428
ee51f6bf-ce1a-11e7-2249-001dd8b721ea,Contract drafts incorrectly completed,212
ee51f6d6-ce1a-11e7-2249-001dd8b721ea,Failure to complete guarantees,498
67af3148-5af9-11e6-2688-00101818ed80,Incorrect loan split,1696
dc5225c7-c92a-11e7-2249-001dd8b721ea,Incorrect or incomplete documentation,1763
e058110f-c792-11e7-2249-001dd8b721ea,Incorrect registration of documents,1898
e0581114-c792-11e7-2249-001dd8b721ea,Incompleteness and incorrectness of the data entered,945
e68cb090-a6a4-11ec-43a8-001dd8b72a55,Incorrect or missing SISBA keys,1791
654b8dd5-9fb5-11ec-275f-001dd8b72a50,Incorrect or complete systems power supply,1731
2bf395ec-af6e-11ec-60ce-001dd8b72a56,Unmanaged failed test results,2872
4d10231b-a04a-11ec-43a8-001dd8b72a55,Consolidated TOE results flow sent incorrect,210
4d102316-a04a-11ec-43a8-001dd8b72a55,Incorrect master data flow sent,1711
e68cb093-a6a4-11ec-43a8-001dd8b72a55, Incorrect or complete daily feeding of Hedge Accounting systems,29
0d81e0a7-9fc2-11ec-275f-001dd8b72a50,Wrong TDE calculation Individual change,2932
4d102310-a04a-11ec-43a8-001dd8b72a55,Sending incorrect individual Tde results,2769
48a05422-b1d5-11ec-275f-001dd8b72a50,Incorrect calculation of the Consolidated Exchange Rate TDE,1299
2bf395e5-af6e-11ec-60ce-001dd8b72a56,Incorrect accounting of exchange rate effectiveness test results,1101
5f57df3a-cad1-11e8-2249-001dd8b721ea,Incorrect completion of the repayment plan,1386
5f57df24-cad1-11e8-2249-001dd8b721ea,Incorrect completion of the transaction,1387
fdc00a13-5a40-11eb-60ce-001dd8b72a56,Incorrect entry of data,1535
c71a6144-6478-11eb-275f-001dd8b72a50,Wrong BO registry update,2920
a9c651b1-e99b-11e9-6ab0-001dd8b72a56,Incorrect or incomplete upload of data to the system,1784
7b4c4a35-7d05-11df-23ab-00505682243b,Misalignment between invoices and accounting flows,2240
9dfdc39a-64c6-11df-23ab-00505682243b,Incorrect data entry,1428
764a454d-3f2b-11e4-2688-00101818ed80,Wrong payment,3140
9dfdc3a9-64c6-11df-23ab-00505682243b,Wrong payment,3140
5fa54bad-3f1c-11e4-2688-00101818ed80,Non-compliant invoices,2381
0e186560-7711-11e9-2249-001dd8b721ea_TRA1,Formally incorrect documentation,728
0e186560-7711-11e9-2249-001dd8b721ea_TRA2,Formally incorrect documentation,728
0e186560-7711-11e9-2249-001dd8b721ea_TRA3,Formally incorrect documentation,728
ccc6d919-554c-11e9-2249-001dd8b721ea,Operation performed incorrectly,2428
00ae0c24-9c29-11ea-1911-001dd8b72a55,Transfer not due,2836
519ac573-0fcd-11e8-2249-001dd8b721ea,Incorrect census of practices,1339
725eb9ca-e185-11e7-2249-001dd8b721ea,Operation carried out in the absence of the enabling requirements,2422
46e8d334-1c01-11ea-6ab0-001dd8b72a56,Presence of positions without SR resolution evaluated with analytical-statistical methods,2577
2870748d-3031-11e9-2249-001dd8b721ea,Incorrect evaluation,1571
dd0d46ea-1cb3-11ea-1911-001dd8b72a55,ROs not transmitted for accounting,2629
b28715b0-71ec-11eb-60ce-001dd8b72a56,Possible incorrect evaluation approach,2500
175e8bb3-0f94-11ea-6ab0-001dd8b72a56,Incorrect data entry in the resolution,1433
c0e7d2f5-6605-11eb-60ce-001dd8b72a56,Resolution carried out without management faculties,2677
98de87c0-71d7-11eb-60ce-001dd8b72a56,Incomplete/outdated documentation and verifications,941
ccaeeaec-499d-11ea-4b37-001dd8b72a50,Resolution carried out without management faculties,2677
d115e837-6a4d-11e8-2249-001dd8b721ea,Covered bonds still outstanding,243
d115e84c-6a4d-11e8-2249-001dd8b721ea,Wrong discharge of warranty,3052
6332bd68-830b-11ea-1911-001dd8b72a55,Wrong certification in the Credit Portal,3000
5ecf48e3-94f6-11ea-4b37-001dd8b72a50,Errors in the acquired documentation and/or errors in entering the relative data in the procedure,378
1120a4d0-ebb6-11ec-43a8-001dd8b72a55,Possible incorrect execution of the SPPI Test,2501
8e3c1057-94f9-11ea-4b37-001dd8b72a50,Incorrect identification of the counterparty and/or its legal representatives,1631
0ebf4077-77f1-11ea-6ab0-001dd8b72a56,Incorrect loading of financial statements (L.262/05),1680
04bc7ef3-8317-11ea-1911-001dd8b72a55,Wrong certification in the Credit Portal,3000
5dbc6991-8307-11ea-1911-001dd8b72a55,"Attribution of Deliberative Competence inconsistent with the ""Credit Faculties"" and the ""Credit Granting Rules""",133
0eb5ca8b-77f1-11ea-6ab0-001dd8b72a56,Failure to fulfill regulatory obligations / request for necessary opinions or unauthorized operation,566
0ebcf67e-77f1-11ea-6ab0-001dd8b72a56,Inadequate analysis or incorrect data entry,758
4b37cdaa-14a2-11df-23a9-00505682243b,Incorrect preparation of information,1849
6e52b7c5-43d4-11e4-2688-00101818ed80,Wrong data,3027
07434ad4-d66f-11e1-714a-002655d352c9,Incorrect preparation of information,1849
755679c4-9423-11dc-1322-000d609809a6,Incorrect preparation of the information to be sent,1854
747c26e9-d640-11e1-714a-002655d352c9,Incorrect preparation of the information to be sent,1854
336b2ba2-9423-11dc-1322-000d609809a6,Incorrect preparation of the information to be sent,1854
755679cb-9423-11dc-1322-000d609809a6,Incorrect preparation of the information to be sent,1854
7558c3b3-9423-11dc-1322-000d609809a6,Incorrect preparation of the information to be sent,1854
b58bfa30-43ec-11e4-2688-00101818ed80,Wrong data,3027
7558c3b0-9423-11dc-1322-000d609809a6,Incorrect preparation of the information to be sent,1854
6ddfe8cc-3ad2-11e2-714a-002655d352c9,Wrong/incomplete list submission,3230
81b19244-18aa-11e0-23ac-00505682243b,Wrong update,3199
31c09610-ce06-11e7-2249-001dd8b721ea,Access by unauthorized third parties with criminal and/or fraudulent intent,69
b8330fca-833c-11e7-2249-001dd8b721ea,Access by unauthorized third parties with criminal and/or fraudulent intent,69
16b2d46e-1f51-11e7-2688-00101818ed80,Risk that the uploaded data is incorrect,2750
3ce49889-1f6d-11e7-2688-00101818ed80,Customer with missing requirements,249
2c72b610-e1a8-11e7-2249-001dd8b721ea,Operation carried out in the absence of the enabling requirements,2422
c5e475cc-0742-11e8-2249-001dd8b721ea,Incorrect census of own account relationships for anti-money laundering purposes,1337
c5e475d9-0742-11e8-2249-001dd8b721ea,Incorrect census of omnibus third-party relationships for anti-money laundering purposes,1336
72375266-c323-11e8-2249-001dd8b721ea_TRA1,Misevaluation of a supplier,2261
72375266-c323-11e8-2249-001dd8b721ea_TRA2,Misevaluation of a supplier,2261
40273f60-6a1a-11eb-60ce-001dd8b72a56,Do not classify all Third Parties cyber relevant,333
10de87f6-9d3b-11e7-2249-001dd8b721ea,Operation performed incorrectly,2428
06857c6e-bc6d-11ea-6ab0-001dd8b72a56,Incorrect location routing,1700
62a8e092-bc7d-11ea-6ab0-001dd8b72a56,Incorrect position hesitation,1838
6220c685-2a78-11ec-60ce-001dd8b72a56,Incorrect accounting,1078
0c04106f-2b25-11ec-60ce-001dd8b72a56,Incorrect or incomplete documentation,1763
bbdeccb2-2b33-11ec-60ce-001dd8b72a56,Offer different from what was deliberated,2418
9efeae61-0820-11ed-2a4f-001dd8b72a55,"Failure to create error knowledge records, failure to document potential solutions.",546
9efeae64-0820-11ed-2a4f-001dd8b72a55,Lack of documentation of identified solutions and application of inappropriate remedial actions.,2164
e63b21f1-4ceb-11e7-2688-00101818ed80,Incorrect data present,1456
5eb7f706-28d1-11e7-2688-00101818ed80,Wrong entry of resolution terms,3072
c023adb0-4850-11ec-43a8-001dd8b72a55,Possible incorrect or incomplete inclusion of the necessary clauses in the contractual draft,2503
1b996461-30c9-11ec-60ce-001dd8b72a56,Contractual documentation not consistent with what was resolved,216
e023bd48-2ffe-11ec-275f-001dd8b72a50,Possible incorrect or incomplete inclusion of the necessary clauses in the contractual draft,2503
0ee74907-357f-11ec-60ce-001dd8b72a56,Carry out pre-delivery checks,165
19d2ff4a-b45c-11e9-4b37-001dd8b72a50,Possible lack of completeness/correctness of the guarantee,2507
3f6358a2-c512-11ea-4b37-001dd8b72a50,Incomplete or incorrect warranty certificate form,900
19d2ff42-b45c-11e9-4b37-001dd8b72a50,Wrong preparation of the text/text inconsistent with what was resolved,3155
b62b55c6-e5eb-11ea-1911-001dd8b72a55,Incomplete perimeter,907
ed6e80b7-f0f4-11ea-1911-001dd8b72a55,Incomplete mapping,876
52d10445-e60b-11ea-4b37-001dd8b72a50,Incomplete mapping,876
280dba03-cb28-11ea-4b37-001dd8b72a50,Intesa Sanpaolo National Documentation and Masterfile not complete,2127
7ef962e8-b0f1-11e8-2249-001dd8b721ea,Incorrect and/or incomplete data,1198
51c458e2-aacd-11e8-2249-001dd8b721ea,Missed/wrong update of economic conditions,2297
54a22d0f-3cf5-11ea-1911-001dd8b72a55,Incorrect or non-regular appraisal and/or guarantee value not correctly reported in the system,1807
2c3dac9c-3d0d-11ea-1911-001dd8b72a55,Incorrect accounting of data,1096
51c458d1-aacd-11e8-2249-001dd8b721ea,Incorrect and/or incomplete data,1198
ef198320-aab1-11e8-2249-001dd8b721ea,Incorrect and/or incomplete data for calculating the TEG,1199
3d1c6ce4-5658-11e2-714a-002655d352c9,Incomplete collected data or incorrect entry into the system,833
3d1c6cd1-5658-11e2-714a-002655d352c9,Incomplete or incorrect reports to be submitted,899
b55cd400-bc78-11dd-23a9-00505682243b,Incomplete collected data or incorrect entry into the system,833
141bc263-4d20-11df-23ab-00505682243b,Incomplete or incorrect reports to be submitted,899
43550cb9-f101-11ea-6ab0-001dd8b72a56,Failure to validate the prices and fair value levels of the receivables,698
9d79cb5a-f0f5-11ea-6ab0-001dd8b72a56,Anomalies in the data download,105
43550c9e-f101-11ea-6ab0-001dd8b72a56,Incorrect or incomplete upload of prices or fair value levels,1785
43550c9b-f101-11ea-6ab0-001dd8b72a56,Incorrect prices and fair value levels,1858
857eefd0-f1d8-11ea-4b37-001dd8b72a50,Incomplete data transmission,852
d3905059-4990-11ea-4b37-001dd8b72a50,Incorrect or incomplete implementation of the interventions requested on the positions being sold,1771
8003fee3-49c2-11ea-1911-001dd8b72a55,Wrong certification,2998
cff62e4d-49bf-11ea-1911-001dd8b72a55,Incorrect or incomplete downloads,1765
ed3805c6-38d3-11ed-2f84-001dd8b72a56,Incorrect NDG perimeter and/or reports,1061
dcb73a5c-847f-11ea-6ab0-001dd8b72a56,Wrong reversal of receipts,3183
51cc3ea6-4ab4-11ea-1911-001dd8b72a55,Wrong transfer amount or currency,3195
ed3805dd-38d3-11ed-2f84-001dd8b72a56,Incorrect variation of personal data notes,2043
5b0d4e76-49ad-11ea-1911-001dd8b72a55,Incorrect yield,2049
89b427d3-4ab6-11ea-1911-001dd8b72a55,Incorrect accounting,1078
d3e0ee3c-49c5-11ea-1911-001dd8b72a55,Migration account squaring,2229
89b427ea-4ab6-11ea-1911-001dd8b72a55,Incorrect accounting of losses/profits from disposal,1103
fbc3a940-7b22-11ea-1911-001dd8b72a55,Timing not respected,2829
ed3805c0-38d3-11ed-2f84-001dd8b72a56,Incorrect NDG perimeter and/or reports,1061
89b427fe-4ab6-11ea-1911-001dd8b72a55,Incorrect accounting of the use of funds,1138
39f22f40-6ada-11eb-43a8-001dd8b72a55,Failure to update the Remediation Plan,689
51eec4c6-0161-11eb-43a8-001dd8b72a55,Check correctness and validity of the contract,180
6fc59023-e6bc-11ea-6ab0-001dd8b72a56,Possible regulatory violation in terms of AML/CTF or countering the financing of terrorism,2513
0203e9e7-e6c8-11ea-6ab0-001dd8b72a56,Check the correctness of the entered data,188
461a27c7-03e7-11eb-60ce-001dd8b72a56,Lists not updated,2194
f80e8a58-8408-11ec-43a8-001dd8b72a55,Wrong data,3027
2b6efdf4-768d-11e7-2249-001dd8b721ea,Incongruous data between Athena and Isidore,958
ef59f094-1315-11e8-2249-001dd8b721ea,Lack of data integrity and quality,2162
ab7e1fef-768f-11e7-2249-001dd8b721ea,Data loading errors,275
41dff01e-f6fb-11e9-6ab0-001dd8b72a56,Incorrect valorisation of the 'Leveraged Transaction' field in the system,2033
9d7a7dc1-9c09-11e9-2249-001dd8b721ea,Incorrect alignment of master data and movements between systems,1166
19805811-c1be-11ea-1911-001dd8b72a55,Non-compliance with scheduled deadlines,2370
95ee8efb-9b5b-11ea-1911-001dd8b72a55,Presence of errors/anomalies of a formal nature,2556
b3108dcd-c9f0-11e7-2249-001dd8b721ea,Incomplete reception,917
872e5efc-b630-11ea-1911-001dd8b72a55,Inconsistent data,993
47ad91a0-c9f4-11e7-2249-001dd8b721ea,Incorrect determination of the value of funds,1508
4c2074d2-c9f7-11e7-2249-001dd8b721ea,Incorrect data,1413
4c2074bc-c9f7-11e7-2249-001dd8b721ea,Incorrect / incomplete accounting entry,1037
3f668a83-4ed7-11e8-2249-001dd8b721ea,Incorrect database,1468
cbf8c7f5-4902-11e6-2688-00101818ed80,"Lack of or incorrect calculation of social security contributions, supplementary fee and customer indemnity",2173
3f3ca3fc-017c-11e6-2688-00101818ed80,Incorrect MAVs,1059
3f3ca3dd-017c-11e6-2688-00101818ed80,Incorrect MAVs,1059
d9799d2d-07c0-11e6-2688-00101818ed80,Incorrect amounts,1174
3c1228e7-fca3-11e5-2688-00101818ed80,Incorrect invoice and Enasarco ceiling threshold not respected,1660
cbf8c7e1-4902-11e6-2688-00101818ed80,Missing or incorrect calculation of the six-month transaction,2307
d078415c-0c02-11e8-2249-001dd8b721ea,Inconsistent data,993
f4e20580-974d-11e9-2249-001dd8b721ea,Unreliable data anticipation,2880
f4e205b1-974d-11e9-2249-001dd8b721ea,Incorrect final data incorporation,1607
44c4ca90-98de-11e9-2249-001dd8b721ea,Incorrect representation of results,1924
786c9b18-9742-11e9-2249-001dd8b721ea,Unreliable data anticipation,2880
786c9b1e-9742-11e9-2249-001dd8b721ea,Inconsistent data anticipation,995
f4e20598-974d-11e9-2249-001dd8b721ea,Incorrect data representation,1461
cc010aa2-9757-11e9-2249-001dd8b721ea,Incorrect reporting/representation,1921
cc010a97-9757-11e9-2249-001dd8b721ea,Data anticipation not representative,256
5a22d93d-9689-11e9-2249-001dd8b721ea,Incorrect representation of results,1924
341caa3a-98e4-11e9-2249-001dd8b721ea,Inconsistent data anticipation,995
5a22d93a-9689-11e9-2249-001dd8b721ea,Unreliable data anticipation,2880
7d1fd1e2-292b-11e8-2249-001dd8b721ea_TRA1,Incorrect reporting,1915
7d1fd1e2-292b-11e8-2249-001dd8b721ea_TRA2,Incorrect reporting,1915
012dd61e-2925-11e8-2249-001dd8b721ea_TRA1,Wrong customer reporting,3026
012dd61e-2925-11e8-2249-001dd8b721ea_TRA2,Wrong customer reporting,3026
a8c48780-ebda-11e8-2249-001dd8b721ea_TRA1,Incorrect tax calculation,1986
a8c48780-ebda-11e8-2249-001dd8b721ea_TRA2,Incorrect tax calculation,1986
983fd732-ebec-11e8-2249-001dd8b721ea_TRA1,Incorrect payments,1829
983fd734-ebec-11e8-2249-001dd8b721ea_TRA1,Incorrect accounting,1078
983fd732-ebec-11e8-2249-001dd8b721ea_TRA2,Incorrect payments,1829
983fd734-ebec-11e8-2249-001dd8b721ea_TRA2,Incorrect accounting,1078
c234dc0e-291b-11e8-2249-001dd8b721ea_TRA1,Incorrect reports to the Italian tax authorities,1922
c234dc10-291b-11e8-2249-001dd8b721ea_TRA1,Wrong reporting to Issuers,3180
cd4fb1f1-291e-11e8-2249-001dd8b721ea_TRA1,Wrong RAD tax certifications,2929
cd4fb1f3-291e-11e8-2249-001dd8b721ea_TRA1,Incorrect balancing of roles,1277
c234dc12-291b-11e8-2249-001dd8b721ea_TRA1,Processing accounts not reconciled,2609
c234dc0e-291b-11e8-2249-001dd8b721ea_TRA2,Incorrect reports to the Italian tax authorities,1922
c234dc10-291b-11e8-2249-001dd8b721ea_TRA2,Wrong reporting to Issuers,3180
cd4fb1f1-291e-11e8-2249-001dd8b721ea_TRA2,Wrong RAD tax certifications,2929
cd4fb1f3-291e-11e8-2249-001dd8b721ea_TRA2,Incorrect balancing of roles,1277
c234dc12-291b-11e8-2249-001dd8b721ea_TRA2,Processing accounts not reconciled,2609
51382243-2917-11e8-2249-001dd8b721ea_TRA1,Incorrect balancing of roles,1277
51382245-2917-11e8-2249-001dd8b721ea_TRA1,Failure to balance various matches,472
51382243-2917-11e8-2249-001dd8b721ea_TRA2,Incorrect balancing of roles,1277
51382245-2917-11e8-2249-001dd8b721ea_TRA2,Failure to balance various matches,472
5138222c-2917-11e8-2249-001dd8b721ea_TRA1,Incorrect quantity or parameters indicated,1886
5138222c-2917-11e8-2249-001dd8b721ea_TRA2,Incorrect quantity or parameters indicated,1886
c234dbeb-291b-11e8-2249-001dd8b721ea_TRA1,Failure to balance credits,466
c234dbeb-291b-11e8-2249-001dd8b721ea_TRA2,Failure to balance credits,466
11662fe9-ee64-11e8-2249-001dd8b721ea,Verification stage incomplete extraction,2898
25add84f-4a2b-11e9-2249-001dd8b721ea,Entries variance detected,357
825c92f1-ee66-11e8-2249-001dd8b721ea,Incorrect production of periodic reporting,1869
8c49bb5c-ee65-11e8-2249-001dd8b721ea,Incorrect report,1913
593b6b30-ceb9-11eb-43a8-001dd8b72a55,Improper charge to customer,749
1afd881c-b1b6-11ec-60ce-001dd8b72a56,No NAV update,2328
ff0b7b56-ab62-11ec-275f-001dd8b72a50,Incorrect registration of the operation in the system,1906
7be3ecd3-c9f8-11ec-275f-001dd8b72a50,Incorrect registration of the commitment to the System Fund,1902
ff0b7b53-ab62-11ec-275f-001dd8b72a50,Incorrect update of the commitment towards the System Fund,2013
c8758ac4-d035-11e7-2249-001dd8b721ea,Failure to comply with occupational safety measures,511
f0bb12f3-b8db-11e7-2249-001dd8b721ea,Incorrect report transfer,1914
d2cefd96-7ada-11e8-2249-001dd8b721ea,Manager non-exclusivity,2216
d2cefd8d-7ada-11e8-2249-001dd8b721ea,Wrong assignment of positions,2967
26d5fdc5-d14f-11e8-2249-001dd8b721ea,Delay in taking charge of the paperwork,311
41ce7ccb-e70b-11eb-275f-001dd8b72a50,Incorrect or missing communications,1792
3c38ce47-ee45-11e8-2249-001dd8b721ea,Wrong sending of documents,3185
3c38ce4c-ee45-11e8-2249-001dd8b721ea,Loss of documentation,2204
ee4abe70-7605-11e8-2249-001dd8b721ea,Manager non-exclusivity,2216
820aeb4b-7ad0-11e8-2249-001dd8b721ea,Wrong assignment of positions,2967
eaa0a309-7846-11e8-2249-001dd8b721ea,Delay in taking charge of the file,310
eaa0a303-7846-11e8-2249-001dd8b721ea,Evaluation start delay,391
eaa0a306-7846-11e8-2249-001dd8b721ea,Incomplete documentation,857
982b2862-f16b-11e8-2249-001dd8b721ea,Incorrect or incomplete documentation submitted,1764
982b285f-f16b-11e8-2249-001dd8b721ea,Loss of documentation,2204
a28ff9ed-cb7b-11e7-2249-001dd8b721ea,Operation blocks,2421
a28ff9ea-cb7b-11e7-2249-001dd8b721ea,Loss/duplication with consequent incremental risk of carrying out fraudulent and/or criminal actions,2209
3373bdcd-384a-11ea-6ab0-001dd8b72a56,Incorrect determination of installments of third-party funds to be paid to the Entity,1490
11bbbd3f-182e-11ea-1911-001dd8b72a55,Failure to meet the deadline established for communicating to the Entity the stipulation and disbursement of the subsidized loan,600
79eccb75-46fe-11e9-2249-001dd8b721ea,Failure to meet the deadline established for signing the contract and disbursing the loan.,602
6f0da55c-457b-11e9-2249-001dd8b721ea,Failure to meet the deadline established for adopting the creditworthiness resolution,597
1706faad-4706-11e9-2249-001dd8b721ea,Incorrect entry of the fund request on the external portal,1558
450b82b4-181a-11ea-4b37-001dd8b72a50,Incorrect determination of the contribution,1500
e6cc0bdb-4590-11e9-2249-001dd8b721ea,Incorrect entry of the resolution communication on the external portal,1563
ee0d4ee7-470c-11e9-2249-001dd8b721ea,Incorrect entry of the fund request on the external portal,1558
8a28220d-dac1-11e9-6ab0-001dd8b72a56,Contribution disbursed inconsistent with the amount received,218
8054316f-384d-11ea-6ab0-001dd8b72a56,Incorrect payment to the Entity of installments of third-party funds,1826
c2c98bd9-099c-11ed-7f82-001dd8b72a50,Lack of documentation of identified solutions and application of inappropriate remedial actions.,2164
c2c98bd4-099c-11ed-7f82-001dd8b72a50,Failure to verify that an Incident has been closed satisfactorily and within an agreed/acceptable time frame,700
c2c98bd2-099c-11ed-7f82-001dd8b72a50,Inability to carry out trend analyzes due to failure to register reports and/or relevant information or from maintaining a complete history,752
f390f069-0996-11ed-7f82-001dd8b72a50,Incorrect prioritization of incidents,1860
f390f063-0996-11ed-7f82-001dd8b72a50,Incorrect classification of incidents and service requests,1351
f390f066-0996-11ed-7f82-001dd8b72a50,Not timely and effective response to user requests or failure to restore normal service. Failure to record reports and/or relevant information,2407
5ed6544f-14ed-11e9-2249-001dd8b721ea,Incorrect signing of the documentation functional to the legal investigation and stipulation.,1953
2cdf773b-17db-11e9-2249-001dd8b721ea,Failure to report a crime that can be prosecuted ex officio by a public service officer,649
5ed6544d-14ed-11e9-2249-001dd8b721ea,Incorrect and/or incomplete documentation functional to the legal investigation and stipulation.,1205
ce3571cf-17d6-11e9-2249-001dd8b721ea,Incorrect/incomplete compilation of the contractual draft.,2066
376e848d-12c0-11e7-2688-00101818ed80,Operations not completed correctly,2434
daeee168-f207-11e6-2688-00101818ed80,Operator error for entering data with contradictory verification,2438
daeee141-f207-11e6-2688-00101818ed80,Exceeding the coverage limit per customer,397
daeee16a-f207-11e6-2688-00101818ed80,Operator error due to incorrect allocation to the income statement,2437
daeee15f-f207-11e6-2688-00101818ed80,Exceeding the treasury limit set for each bank,399
daeee161-f207-11e6-2688-00101818ed80,Accounting not pertinent,74
bc235a02-00b7-11ea-4b37-001dd8b72a50_TRA1,Inconsistent repayment plan,1019
bc235a02-00b7-11ea-4b37-001dd8b72a50_TRA2,Inconsistent repayment plan,1019
2c1a4e87-00ba-11ea-4b37-001dd8b72a50_TRA1,Incorrect entry of resolution data,1546
2c1a4e87-00ba-11ea-4b37-001dd8b72a50_TRA2,Incorrect entry of resolution data,1546
ae197eb3-eac7-11eb-43a8-001dd8b72a55_TRA1,Wrong entry,3058
ae197eb3-eac7-11eb-43a8-001dd8b72a55_TRA2,Wrong entry,3058
ae197eb0-eac7-11eb-43a8-001dd8b72a55_TRA1,Wrong entry,3058
ae197eb0-eac7-11eb-43a8-001dd8b72a55_TRA2,Wrong entry,3058
