controlCategory,controlType,controlPeriodocity,control,controlID
NA,Semi-automatic,0.1,Verify The Correctness/Completeness Of The Input Data,130046
NA,Manual,0.1,Monitor Phases,128496
NA,NA,,Check The Correctness Of The Flow,118236
NA,NA,,Verify The Correctness Of The Sign Base,100921
NA,Manual,0.1,Check The Consent Of The Trading Desk,110316
NA,Semi-automatic,1.0,Check The Reconciliation Result,108774
NA,NA,,Monitor The Correctness Of The Documentation With Impacts On Health And Safety In The Company,112066
NA,NA,,Verify That The Training Plan In Place Guarantees Sufficient And Adequate Training On Occupational Health And Safety,123625
NA,NA,,Monitor The Use Of Mandatory Courses By Reporting The Oldest Training Gaps And Analyzing Satisfaction Data,111269
NA,Semi-automatic,365.0,Verify That There Is No Waste In The Stream,111986
NA,NA,,Check The Correctness Of The Data,107507
NA,Semi-automatic,365.0,Check And If Necessary Correct The Flows Produced By The System,121431
NA,Semi-automatic,365.0,Examine Scraps And Fix Anomalies,120388
NA,Semi-automatic,365.0,Identify And Fix Anomalies,114337
NA,Semi-automatic,365.0,Review Diagnostic Results And Correct Flow,131062
NA,Manual,0.1,Check The List And Activate The Automatic Evaluation Procedure,113841
NA,NA,,Check The Adequate Formalization Of The Accident,135238
Operational,NA,,Check The Proper Formalization Of The Incident,126122
NA,Manual,0.1,Verify The Correct Closure Of The Problem,133596
NA,Manual,1.0,Verify That The Problem Has Been Dealt With By The Competent Structures Within The Foreseen Times,110534
NA,NA,,Carry Out Checks On The Location Proposed In The Request,100088
NA,NA,,Verify Correct Management System Alignment,100087
NA,Manual,0.1,Verify The Conclusion Of The Interventions And Fulfilments Consequent To The Release Of The Opinion,106152
Operational,Manual,365.0,Verify That The Practices With Approved Risk Are Cloned,131532
NA,Manual,365.0,Check The Closure Of Practices And Active Amendments,100391
NA,Manual,365.0,Check The Approval Level Of Practices With Estimated Data,114846
Professional,Manual,0.1,Authorize Business Plan Light,110739
Operational,Manual,1.0,Verify Exact Assignment,100752
NA,NA,,Carry Out Checks On Any Cancellation Operations Subject To Reporting,108758
NA,NA,,Carry Out Checks On The Cancellation Operations Subject To Reporting,132697
NA,NA,,Carry Out Checks On Any Cancellation Operations Subject To Reporting,130646
NA,NA,,Monitor The Operations Carried Out By The Supervisee In Financial Instruments Or Investment Services,122368
NA,Manual,0.1,Check The Consistency Between The Data In The Procedure And The Documentation Received,104514
NA,Manual,7.0,Monitor The Deadlines For The Approval Of The Loan,114857
NA,Manual,7.0,Monitor Deadlines For Completion,124499
NA,Manual,7.0,Monitor The Timing Of The Practices Being Finalized,132719
NA,Manual,0.1,Check The Consistency Between The Information And The Disbursement Documentation With The Communication To Be Forwarded To The Body,123359
NA,Manual,0.1,Check The Consistency Between The Data In The Procedure And The Documentation Received,130718
NA,Manual,0.1,Check The Consistency Between The Data In The Procedure And The Documentation Received,119734
NA,Manual,0.1,Ascertain The Correctness Of The Payment Of The Installments To The Entity,113238
NA,Manual,7.0,Monitor The Timing Of The Practices Being Evaluated,132718
NA,Manual,0.1,Check The Data Entered In The Manual Reporting,108740
NA,Semi-automatic,0.1,Reconcile Managerial Data With Accounting Data,108011
NA,Manual,0.1,Check The Amount Distributed,126514
Professional,Manual,0.1,Verify The Correct Inclusion Of The Covenants In The Contract,126513
NA,Manual,0.1,Verify The Correct Execution Of The Guarantees,132643
Professional,Manual,0.1,Verify The Correct Completion Of The Contract.,115378
NA,Manual,0.1,"Verify That You Have Performed The Sppi Test For Changes During The Approval/Perfection Phase And, Based On The Outcome Of The Test, Carry Out The Necessary Activities",109650
Operational,Automatic,30.0,Check For The Presence Of The Syndicated Contract Identifier,115376
Professional,Manual,0.1,Check That The Teg Has Been Checked,115377
NA,Manual,0.1,Evaluate And Review The Request,132222
Operational,Manual,0.1,Verify And Publish The Final Card,105682
NA,Manual,0.1,Verify The Attribution Of The Accounts To Official And Reclassified Balance Sheet Items,101189
NA,Manual,0.1,Check The Entered Data,123952
Operational,Semi-automatic,30.0,Check That The Card Has Been Updated Correctly,105680
Operational,NA,,Verify The Correct Execution Of The Defined Training Plan,101179
NA,Manual,0.1,Check The Requirements - I Level Of Authorization,116564
NA,Manual,0.1,Check The Requirements - Ii Level Of Authorization,114788
NA,Manual,0.1,Check The Requirements,118892
NA,Manual,0.1,Check The Requirements - Iii Level Of Authorization,115309
NA,Manual,0.1,Verify That The Settlement Has Been Successful,116989
NA,Manual,0.1,Verify That The Payment Was Successful,116990
NA,NA,,Verify That The Request Of The Interested Party Has Been Correctly Managed On The Information Systems,134767
NA,NA,,Verify That The Request Of The Interested Party Has Been Correctly Managed On The Information Systems,101297
NA,NA,,Check That The Documentation Sent To The Interested Party Does Not Contain Personal Data Of Third Parties,114691
NA,NA,,Verify That The Request Of The Interested Party Has Been Correctly Managed On The Information Systems,134768
NA,NA,,Verify That The Outcome Of The Automated Decision Process Has Been Manually Corrected,125113
NA,NA,,Verify That The Corrections/Integrations Of Personal Data Have Been Made,101298
NA,NA,,Verify That The Request Of The Interested Party Has Been Correctly Managed On The Information Systems,133492
NA,NA,,Check That The Documentation Sent To The Interested Party Does Not Contain Personal Data Of Third Parties.,125112
Operational,NA,,Identify Blocked Operations In Accounting And Resolve Any Anomalies,130256
NA,Semi-automatic,0.1,Check Individual Options Expiring Positions,124392
NA,Semi-automatic,0.1,Verify Regulation And Make Adjustments,130682
NA,NA,,Check The Findings Of The Branch,112893
NA,Semi-automatic,0.1,Verify In The System That The Service Has Been Deactivated,106526
NA,NA,,Verify That The Guarantee Acquisition Phase Is Correct,133132
NA,Semi-automatic,0.1,Confirm Cash Collateral / Personal Guarantee In Ledger Systems,102608
NA,Semi-automatic,0.1,Check That The Metadata Is Entered Correctly,109728
Professional,Manual,0.1,Check Data Entry Congruence In Wl,113825
NA,NA,,Check The Timing,110862
NA,Manual,92.0,Check Effective Preparation And Successful Transfers,132895
NA,NA,,Check The Timing,135204
Professional,Manual,30.0,"Check Effective Input Data Extraction Of Interest, Commissions, Account Balance And Write-Offs",131713
Professional,Manual,30.0,Check Effective Margin Input Data Extraction,131712
Operational,Manual,30.0,Carry Out The Consistency Check,116568
NA,Manual,92.0,Check The Effective Communication Of Payment Data,112342
NA,NA,,Check The Timing,110863
NA,NA,,Check The Timing,117014
NA,NA,,Check The Data Of The Active Invoice,135206
NA,Manual,30.0,Check The Output,110269
Professional,Manual,30.0,Check Effective Input Data Extraction Of Perforating Reasons,105118
NA,Manual,92.0,Check Accounting,105612
NA,NA,,Check The Timing,135205
Professional,Semi-automatic,92.0,Check Simulation Output,107842
NA,Semi-automatic,92.0,Perform Diagnostics And Verify The Integrity/Goodness Of Data And Analysis Parameters,107843
NA,NA,,Verify And Validate The Correct Acquisition Of The Documentation,131102
NA,NA,,Validate The List,131103
NA,Manual,30.0,Carry Out Drift And Trend Checks,104412
NA,Manual,30.0,Carry Out Deviation And Performance Checks Of The Measurements Of The Banks In The Isbd Perimeter And Other Decentralized Ones,135355
NA,Manual,30.0,Monitor Compliance With Operating Limits,135356
NA,Manual,0.1,Verify Correct Limit Update,104413
NA,Manual,30.0,Verify Proper Loading Of System Tables,104411
NA,Semi-automatic,30.0,Check The Diagnostics Of The Calculation Of The Risk Measures,133090
NA,Manual,182.0,Check Expected Loss Update,133089
NA,Manual,0.1,Verify That The Relief Has Been Processed,129204
NA,Manual,0.1,Verify The Information Received Or Produced,121651
NA,Semi-automatic,0.1,Verify Data Entered To Create Purchase Order,132850
NA,Manual,0.1,Check Consistency Of Prepared Documentation,107729
NA,Semi-automatic,0.1,Verify Correct Execution Of The Authorization Procedure,104433
NA,NA,,Check The SupplierS Order Confirmation,107728
NA,NA,,Verify The Purchase Order Issue Data,107726
NA,Manual,92.0,Verify Reconciliation With Accounting,117620
NA,Manual,92.0,Verify Correct Data Download,115199
NA,Manual,30.0,Verify Correct Accounting,121605
NA,Manual,92.0,Verify The Consistency Between The General Ledger And The Budget Application,113789
NA,Manual,30.0,Check Risk Retention Percentages On Garc Tranches,132728
NA,Automatic,30.0,Verify The Correct Entry In Sire Of The Data Relating To The Generic Reserve Of The Foreign Branches,109742
NA,Manual,30.0,Compare The Expected Loss Data With The Definitive Generic Reserve,121789
NA,Manual,30.0,Verify Consistency And Completeness In Determining The Definitive Generic Reserve,132729
NA,Manual,30.0,Verify The Correct Determination Of The Generic Definitive Reserve For Operating Credits.,103530
NA,Manual,92.0,Verify Hedge Accounting Coverage,121604
NA,Manual,30.0,Check Data Acquisition For Performing Credit Reserve Calculation,118190
Professional,Manual,0.1,Verify Final Business Plan,121743
NA,Manual,0.1,Verify The Correct Discharge Of The Guarantee,124666
NA,NA,,Check The Correspondence Of The Actual Final Recipient With The Form,122208
NA,NA,,Check Correct Completion Of The Form,103550
NA,NA,,Check For Privacy Consent C6,106431
NA,Semi-automatic,92.0,Verify The Correctness Of The Reported Data,130097
NA,Automatic,92.0,Check That The Data Has Been Loaded Correctly,116822
NA,Semi-automatic,92.0,Verify The Correctness Of The Data Produced By The Application,115858
NA,Semi-automatic,92.0,Verify The Complete And Correct Loading Of The Data,109154
NA,Manual,92.0,Carry Out A Trend Analysis Of The Data,103264
NA,Semi-automatic,92.0,Check The Correct Import Of Data Into The Application,107969
NA,Manual,92.0,Verify The Complete Fulfillment Of The Reliefs,103495
NA,NA,,Check That The Data Has Been Sent,109155
NA,Semi-automatic,92.0,Verify The Correctness And Completeness Of The Processing Carried Out,130095
NA,Manual,92.0,Verify That All Packages In The Phase Are Certified,115154
NA,Automatic,92.0,Verify That The Errors Have Been Corrected,116824
NA,Semi-automatic,92.0,Check The Corrections Of The Structures Responsible For Entering The Data,103266
NA,Semi-automatic,92.0,Check The Corrections Of The Structures Responsible For Entering The Data,115153
NA,Semi-automatic,92.0,Run The Diagnostic At The Original Scenario Level And Verify The Diagnostics,120682
NA,Automatic,92.0,Verify The Completion Of The Consolidation,131762
NA,Semi-automatic,92.0,Run The Diagnostic Procedure At The Original Scenario Level And Verify Its Outcome,109572
NA,Semi-automatic,92.0,Run The Diagnostic Procedure At The Original Scenario Level And Verify Its Outcome,133419
NA,Semi-automatic,92.0,Verify The Correctness And Completeness Of The Processing Carried Out,100082
NA,Semi-automatic,1.0,Check For Negative Balances,131803
NA,NA,,Check That Privileges Are Revoked If No Longer Needed,108227
Operational,NA,,"Check Alignment Between Administrative Privilege, Enabling Code And Assignment Code",123011
NA,Manual,92.0,Check The Data Calculated For Exposure From Securitizations Of Sponsoring Companies,123442
NA,Manual,92.0,Check The Data Calculated For Traditional Own Securitisations,123453
NA,Manual,92.0,Check The Data Calculated For Synthetic Securitisations,123450
NA,Manual,92.0,Check The Data Calculated For Third Party Securitizations,123452
NA,Semi-automatic,365.0,Perform Checks On Totals,133267
NA,Semi-automatic,365.0,Check The Data Entered In Form 770,133268
NA,Semi-automatic,365.0,Check And Correct The Data,118383
NA,NA,,Take Action In The Event Of An Abnormal Termination Of Processing,118382
NA,Manual,365.0,Compare The Available Evidence With The Owner Structures,135117
NA,Manual,0.1,Verify The Correct Registration Of The Guarantees,111314
NA,Manual,0.1,Check The Completeness Of The Documents And The Document Registration Data,102904
NA,Manual,0.1,Check The Correct Compilation Of Any Missing Parts,116056
NA,Manual,0.1,Wrong Preparation Of The Text,116055
NA,Manual,0.1,Verify All The Data And Signatures Required In The Certification Of Warranty Form,127682
NA,Manual,1.0,Tick Error Counting Operations,102393
NA,Manual,0.1,Check For Permission To Proceed,102378
NA,Manual,1.0,Check For Open Positions,102387
NA,Manual,0.1,Check That The Data Has Been Uploaded,121344
NA,Manual,0.1,Verify The Correctness Of The Data Subject To The Contribution,105321
NA,Manual,0.1,Verify The Contribution Has Been Made,104308
NA,Manual,0.1,Verify Assignment Of Yarl To New Contributing Facility,110741
NA,Manual,0.1,Check Siding Census,135329
NA,Manual,0.1,Verify The Correct Registration Of The First Manual Note,123436
NA,Semi-automatic,1.0,Check For Misalignments Between Ledger And Accounting,135327
NA,Semi-automatic,1.0,Check The Outcome Of The Processing Performed By The System,129122
NA,Manual,1.0,Check The Correspondence Between Ledgers And Account Balances,121718
NA,Manual,1.0,Verify Accounting Consistency Within The Sire Ledger,121721
NA,Manual,1.0,"Verify, And Possibly Complete, The Census Of Elementary Accounts",121720
NA,Semi-automatic,0.1,Check The Outcome Of Sending The Supplementary Flow Of The Supervisory Report,123432
NA,Semi-automatic,30.0,Check The Result Of Sending Data For Supervisory Reporting,132814
NA,Manual,30.0,Check The Supervisory Reporting Form With The Account Balance,121719
NA,NA,,Verify Effective Compliance With The Agreements,107058
NA,NA,,Verify Effective Compliance With The Agreements,107822
NA,Manual,0.1,Verify Correctness And Congruence Of The Census Of The Voluntary Mortgage,105318
Professional,Manual,0.1,Check That The Data Entered Manually Is Correctly Entered,113088
NA,Manual,0.1,Verify Correctness And Congruence Of The Census Of The Judicial Mortgage,105317
NA,Semi-automatic,0.1,Check The Correctness Of The Operation On The Position Keeping System,120849
NA,Semi-automatic,0.1,Check For Stuck Or Error Messages,109257
NA,Semi-automatic,0.1,Check For Errors Or Pending Messages,117230
NA,NA,,Verify Successful Completion Of The Transfer,131632
NA,Automatic,0.1,Check The Valorisation Of The Fields Necessary For The Classification Of A Report In The Non-Finance Area,119410
NA,Automatic,0.1,Verify That Required Information Is Entered When Opening And Closing The Incident,125922
NA,Automatic,0.1,Check The Enhancement Of The Priority Level Of An Incident,127727
NA,Automatic,0.1,Check The Enhancement Of The Priority Level Of An Incident.,135153
NA,Automatic,0.1,Verify The Closure Of The Incident,111111
NA,Automatic,0.1,Verify The Correct Archiving Of Incidents,111112
NA,Automatic,0.1,Check The Recovery Note Documentation For An Incident,111110
NA,Semi-automatic,1.0,Verify The Completeness And Correctness Of The Day-End Data Downloads,126764
NA,Manual,1.0,Evaluate The Acceptability Of The Price Change Proposed By The Trader,125807
NA,Semi-automatic,1.0,Check The Completeness And Correctness Of The Data Received From Infoprovider,108384
NA,Semi-automatic,1.0,Verify The Completeness And Correctness Of The Day-End Data Downloads,126765
NA,Manual,0.1,Verify Correct Updating Of The Plan And Connection Of The Accounts,131741
NA,Automatic,30.0,Check The Outcome Of The Processing Phases Of The Financial Engine,110546
NA,Automatic,30.0,Report Completion Of The Preparation Of Reports And Diagnostics,118161
NA,Semi-automatic,30.0,Carry Out The Performance Check Of The Input Data For The Euro Area Sub-Consolidated Perimeter,111447
NA,Semi-automatic,0.1,Verify The Consolidation Process Of The Euro Area Sub-Consolidated Perimeter,123773
NA,Semi-automatic,30.0,Verify Correct Acquisition Of The Flows Received In The Staging Area,110545
NA,NA,,Analyze The Changes And Verify The Performance Trends Of The Balance Sheets,135311
NA,NA,,Monitor The Operations Carried Out By The Supervisee In Financial Instruments Or Investment Services,116503
NA,Manual,0.1,Check The Documents Loaded In The Envelope,120993
NA,Manual,0.1,Check The Entered Data,118951
NA,Manual,0.1,Check The Interventions Carried Out,121358
NA,Manual,30.0,Make The Balances Of The Economic Items (Pecobill - Ncg),101752
NA,Semi-automatic,30.0,Check Valuation Of Accruals On L&R Securities,101750
NA,Manual,30.0,Make Balances Between Sectional Accounting And General Accounting,101749
NA,Semi-automatic,30.0,Verify Correct Accounting Of The Amortized Cost,101748
NA,Manual,0.1,Check The Documentation Signed By The Customer,132388
NA,Semi-automatic,1.0,Verify The Completeness And Correctness Of The Day-End Data Downloads,111657
NA,Semi-automatic,1.0,Perform Qualitative And Quantitative Controls,105156
NA,Semi-automatic,1.0,Verify The Completeness And Correctness Of The Day-End Data Downloads,111131
NA,Manual,0.1,Carry Out The Preliminary Checks On The Possibility Of Operating On The Foreign Market For The Debtor,112604
NA,Manual,30.0,Check Correct Compilation Of The Forms,132685
NA,Semi-automatic,30.0,Check Your Submissions,132686
NA,Semi-automatic,92.0,Verify The Correctness Of The Information Acquired Relating To The Additional Information,128407
NA,Manual,92.0,Check The Alignment Between The Data Acquired From The Historical Archive And Accounting,109440
NA,Manual,92.0,Verify The Alignment Between The Data Acquired Relating To The Adjustments On Non-Performing Derivatives And The Accounting,110312
NA,Semi-automatic,92.0,Verify The Alignment Between The Balance Sheet Archive And Accounting,109438
NA,Manual,92.0,Reconcile The Balance Sheet Items With The Ias Ledger Balances Generated By The Balance Sheet Archive,104627
NA,Semi-automatic,92.0,Examine The Report Generation Error Logs,104626
NA,Manual,92.0,Verify The Correctness Of The Information Acquired Relating To Credit Adjustments,124804
NA,Semi-automatic,92.0,Check The Imported Data,127514
NA,Automatic,92.0,Supervise The Processing Phases,120614
NA,Manual,7.0,Check Criticality Level Locations To Assign,118881
NA,Manual,30.0,Verify The Correct Assignment Of The Level Of Criticality,113976
Operational,NA,,Trace Accesses (Allowed And Denied) To Cloud Azure Systems By Means Of Automatic Tools,107425
Operational,NA,,Trace The Use Of The Areas And Spaces Given For Viewing By Guest Users,115912
Operational,NA,,Ensure That Automated Deprovisioning Processes Are Operating Properly Through Monitoring Systems,125131
Operational,NA,,Ensure That Automatic Provisioning Processes Are Operating Properly Through Monitoring Systems,116617
NA,Semi-automatic,92.0,Carry Out Formal Checks,115726
NA,Semi-automatic,92.0,Perform Correctness And Consistency Checks,115727
NA,Semi-automatic,92.0,Carry Out Performance And Consistency Checks,115023
NA,Semi-automatic,92.0,"Oversee The Outcome Of Statistical, Performance And Consistency Checks",133012
NA,Automatic,92.0,Supervise The Outcome Of The Automatic Technical Checks,133011
NA,NA,,"In The Post-Sales Management Phase, Check The Completeness And Correctness Of The Data In The Registry",122078
NA,Manual,0.1,Check Data Loaded Into The System,115278
NA,Manual,7.0,Check Outstanding Sdd Debit Provisions,107898
NA,Manual,1.0,Check Consistency Between Billing Data And Sdd Charge Flows,115280
NA,Manual,0.1,Check That The Amount Entered Has Been Paid And Communicate Payment Made By Email To The Reference Structure.,110226
NA,Manual,0.1,Verify The Correctness Of The Submitted Documentation.,102345
NA,Manual,0.1,Verify The Correctness Of The Documentation Produced,135082
NA,Manual,0.1,Check The Correctness Of The Guaranteed Amount,110225
NA,Semi-automatic,0.1,Check The Correctness Of The Data,131548
NA,Semi-automatic,0.1,Check The Correctness Of The Data,133091
NA,Manual,0.1,Check The Correctness Of The Data Present In The Lrs System,131653
NA,Manual,0.1,Analyze The Received Data,131652
NA,Manual,0.1,Verify The Data Present In Hermione,118555
NA,Manual,1.0,Check The Correctness Of The Downloaded Database,123582
NA,Manual,1.0,Check That The Entered Data Is Correct,123584
NA,Manual,1.0,Verify The Correctness Of The Data Entered In The Front Office Systems,123583
NA,Manual,365.0,Perform Consistency Checks,125393
NA,Manual,365.0,Check The Correctness And Completeness Of The Uploaded Data,103877
NA,Manual,365.0,Verify That The Tabs Are Correct,113104
NA,Manual,365.0,Verify The Consistency Of The Acquired Data,128635
NA,NA,,Verify The Identity Of The Applicant,132822
NA,NA,,Verify The Identity Of The Applicant,100238
NA,NA,,Verify The Identity Of The Applicant,132821
NA,Manual,30.0,Verify The Correct Recognition Of The Releases Of The Provision For Risks,100079
NA,Semi-automatic,30.0,"Carry Out A Reconciliation Of The Fund, Of The Receivables From The Tax Authorities In Capital And Interest Accounts, Of The Related Debts By Comparing The Management With The Accounting",126405
NA,Manual,30.0,Check And Arrange Scraps In Pandora,107881
NA,Manual,30.0,Verify The Consistency Of Interest Income And Accruals For The Period,125457
NA,Manual,92.0,Carry Out An Analytical Reconciliation Of The Miscellaneous Items And Of The Accounting Of Interest On Payables And Receivables,109352
NA,Semi-automatic,30.0,Check In Pandora The Correct Generation Of The Flow To Be Transmitted To The Accounting System,109351
NA,Semi-automatic,30.0,Verify The Correct Generation Of The Event For Posting The Adjustment Entry,122835
NA,Semi-automatic,92.0,Verify The Consistency Of The Provision Entered In The System With What Was Resolved,130534
NA,Semi-automatic,30.0,Verify The Correct Accounting Of The Flow Transmitted By Pandora In The Accounting System,122837
NA,Semi-automatic,30.0,Check In Pandora The Correct Generation Of The Flow To Be Transmitted To The Accounting System,122836
NA,Semi-automatic,92.0,Verify The Consistency Of The Provision Entered In The System With What Was Resolved,112961
NA,Semi-automatic,30.0,Check In Pandora The Correct Generation Of The Flow To Be Transmitted To The Accounting System,112963
NA,Semi-automatic,30.0,Verify The Correct Accounting Of The Flow Transmitted By Pandora In The Accounting System,112964
NA,Semi-automatic,30.0,Verify The Correct Generation Of The Event For Posting The Adjustment Entry,112962
NA,Manual,0.1,Verify The Valorisation Proposal For The Data Pertaining To Financial Risks,114234
NA,Manual,0.1,Check The Valorisation Proposal For The Credit Risk Data,114235
NA,NA,,Verify The Correctness Of The Communication,123316
NA,NA,,Verify The Correctness Of The Statement,123317
NA,NA,,Verify The Existence Of The Conditions For The Delay,102158
NA,NA,,Verify The Correctness Of The Communication Of The Information,107867
NA,Manual,,Definitively Check The Presence And/Or Capacity Of The Credit Line,134413
NA,NA,,Check That The Pricing Policy And The Allocation Policy Have Been Sent To The Issuer.,122691
NA,NA,,Check The Contents Of The Mandate,116598
NA,Manual,,Verify The Acquisition Of Consent By The Head Of Management For The Application Of The Commission Not In Line With The Dcm Commission Tables.,108447
NA,Manual,,Definitively Check The Presence Or Capacity Of The Credit Line,123792
NA,Manual,0.1,Verify The Correct Compilation And Signing Of The Contractual Documentation,123404
NA,Manual,0.1,Verify The Correctness Of The Contractual Documentation Produced,116496
NA,Manual,0.1,Verify The Correct Compilation And Signing Of The Contractual Documentation,103161
NA,Manual,0.1,Verify The Correctness Of The Data Entered In The Procedure,123403
NA,Manual,0.1,Verify The Correctness Of The Data Entered In The Procedure,118662
NA,Manual,0.1,Verify The Correctness Of The Contractual Documentation Produced,103810
NA,Manual,0.1,Verify The Correct Compilation And Signing Of The Contractual Documentation,127366
NA,Manual,0.1,Verify The Correct Compilation And Signing Of The Contractual Documentation,116928
NA,Manual,0.1,Verify The Correctness Of The Data Entered In The Procedure,116927
NA,Manual,0.1,Verify The Correctness Of The Documentation Produced,112265
NA,Manual,0.1,Verify The Correctness Of The Data Entered In The Procedure,100989
NA,NA,,Verify The Correctness Of The Contractual Documentation Produced,111491
NA,NA,," Verify The Truthfulness, Completeness, Adequacy Of The Data And Information",131730
NA,NA,," Verify The Truthfulness, Completeness, Adequacy Of The Data And Information",113753
NA,NA,,Verify The Formal Correctness Of The Arrangements,132757
NA,NA,,Verify The Formal Correctness Of The Arrangements,132758
NA,NA,,Verify Logical And Formal Differences In Procedure,100046
NA,NA,,Verify Logical And Formal Differences In Procedure,100047
NA,NA,,Verify Capital Gains Statement To Be Sent To Customers,135257
NA,NA,,Verify Capital Gains Statement To Be Sent To Customers,135258
NA,NA,,Verify Correct Zeroing Of Masters,104805
NA,NA,,Verify Correct Zeroing Of Masters,104806
NA,NA,,Check Current Account Debit Transactions,125194
NA,NA,,Check Current Account Debit Transactions,125195
NA,NA,,Verify Operating Results Determined By Procedure,100048
NA,NA,,Verify Operating Results Determined By Procedure,100049
NA,NA,,Verify The Passage Of Debits On Customer Current Accounts,125200
NA,NA,,Check Monthly Processing Booking Result,125198
NA,NA,,Verify The Passage Of Debits On Customer Current Accounts,125201
NA,NA,,Check Monthly Processing Booking Result,125199
NA,NA,,Verify And Authorize Sending Certifications To Customers,135263
NA,NA,,Verify And Authorize Sending Certifications To Customers,135264
Professional,Semi-automatic,0.1,Check The Machining Of The Positions,115094
