controlCategory,controlType,controlPeriodocity,control,controlID
NA,NA,,Verify Completeness Of The File,115545
NA,NA,,Check If The Practice Has Generated The Activation Of The Lil Or Il,115418
NA,NA,,Verify Completeness Of The File,115468
NA,NA,,Verify Completeness Of The File,115472
NA,NA,,Verify Completeness Of The File,115551
NA,NA,,Check If The Compliance Assessments Have Been Carried Out And If The Case Has Generated The Activation Of The Lil Or Il,115549
NA,NA,,Verify Completeness Of The File,115544
NA,Manual,365.0,Check Feedback,121182
NA,Manual,0.1,Check Report With Returns,107644
NA,Manual,0.1,Verify Concordance,133204
NA,Manual,365.0,Verify Correspondence Of The Definitive Pdf Of The File,101515
NA,Manual,0.1,Check The English Text Of The Report,125924
NA,Manual,0.1,Check The Section Of The Report You Are Responsible For Drafting,133208
NA,NA,,Verify That The Profiled Customers In The Medium Or High Risk Range Have Been Evaluated,119801
NA,Manual,0.1,Check The Analyzes Performed,129963
NA,Manual,0.1,Check The Correspondence Of The Goods Covered By The Guarantee And The Guarantee Data Entered In The System.,120550
NA,Manual,0.1,Verify The Correct Execution Of The Solely Payments Of Principal And Interest Test - Sppi Test And Communicate The Outcome To The Proponent,100026
NA,Manual,0.1,Verify The Calculation Of The Deliberative Competence,129928
NA,Manual,0.1,Check That The Tool For Carrying Out The Sppi Test Present In The Credit Portal Is Correctly Powered.,119404
NA,Manual,0.1,Verify Receipt Of All Necessary Admissibility Opinions.,129929
NA,Manual,0.1,Verify The Completeness Of The Documentation Of The Credit Proposal,106826
NA,Manual,0.1,Verify The Correctness And Completeness Of The Data Entered In The Credit Portal,112657
NA,Manual,0.1,Verification Of The Correctness Of The Data Entered For The Calculation Of The Gross Financial Debt / Ebitda Ratio And Of The Correct Compilation Of The Related Pdc Fields.,114088
NA,Manual,30.0,Check The Test Results,121172
NA,Semi-automatic,0.1,Verify Correct Entry Of Data Into The System,111925
NA,Semi-automatic,0.1,Check Lines Of Credit,100608
NA,Manual,0.1,Verify The Correctness Of The Calculation Of The Level Of Funding For The Pricing Of The Issue,116088
NA,Manual,0.1,Verify The Correctness And Completeness Of The Documentation Prepared,104714
NA,Manual,0.1,Verify The Correctness And Completeness Of The Documentation Prepared,103160
Operational,NA,,Check The Need For Early Repayments Of The Provision.,129698
NA,Manual,0.1,Verify The Correct Accreditation To Sace,124255
NA,Semi-automatic,0.1,Check The First Notes,106466
NA,Manual,365.0,Check The Correctness Of The Accounting,115709
NA,Manual,365.0,Verify The Correctness Of The Accrued Interest,109957
NA,Manual,365.0,Verify The Consistency Of Data At Group Level And Report Any Misalignments Found,131830
NA,Semi-automatic,365.0,Check That The Template Has Been Sent To The Bank Of Italy,126693
NA,Manual,365.0,Check The Consistency Of The Contribution Estimate,123128
NA,Manual,365.0,Check The Correctness Of The Accounting,109477
NA,Semi-automatic,365.0,Verify The Sending Of The Declaration To The Bank Of Italy,119197
NA,Manual,365.0,Check The Consistency Of The Entered Data,105781
NA,Semi-automatic,365.0,Check The Correctness And Completeness Of The Data Entered,105780
NA,Manual,365.0,Verify The Correctness Of The Payment Made,109478
NA,Manual,365.0,Verify The Correct Adjustment Of The Items To Be Accounted For,108745
NA,Manual,92.0,Verify That The Reliefs Have Been Processed,109476
NA,Manual,365.0,Verify The Correctness Of The Accounting Entry,109479
NA,Semi-automatic,30.0,Verify The Correct And Complete Entry Of Third-Party Entries,131707
NA,Semi-automatic,30.0,"Verify The Input Data To The Accounting Systems, In Relation To The Income Statement",106522
NA,Semi-automatic,30.0,Verify The Input Data To The Accounting Systems Relating To The Balance Sheets,106521
NA,Semi-automatic,30.0,Verify The Correct Execution Of The Interventions,117954
NA,Semi-automatic,30.0,Check For The Presence Of Quadrator Flows To Be Authorized Or Not Received Without Justification,123832
NA,Semi-automatic,30.0,Verify That Standard Controls With Ko Results Are Justified,121556
NA,Semi-automatic,30.0,Verify That Standard Controls With Ko Results Are Justified,106958
NA,Semi-automatic,30.0,Check For The Presence Of Quadrator Flows To Be Authorized Or Not Received Without Justification,106957
NA,Semi-automatic,30.0,Verify The Correct And Complete Entry Of The Initiative Income And Balance Sheet Entries,103740
NA,Manual,30.0,Verify The Correct Classification Of The Loss On The Basis Of The Amount And Carry Out The Checks Envisaged For The Authorisation,122278
NA,Manual,30.0,Verify The Correct And Exhaustive Periodic Control Activity,129581
NA,Manual,0.1,Verify The Carrying Out Of The Balancing Activity,122277
Operational,Manual,0.1,Verify The Correct Draw Operation In The Application,108981
Operational,Manual,0.1,Correct Insertion In The Application Of The Request For Loss,108982
Operational,Manual,30.0,Verify The Correct And Complete Execution Of Accounting Entries,108983
NA,Manual,0.1,Check The Data,111812
NA,Manual,0.1,Check The Data,121101
NA,Manual,365.0,Verify The Correct Loading Of The Budget Data,124831
Professional,Manual,30.0,Verify And Reconcile Balances,109993
NA,Manual,92.0,Check The Perimeter Of The Companies,127345
NA,Manual,30.0,Verify Account Balances,130945
Operational,Semi-automatic,30.0,Validate The Data Entered And Verify That The Certification Has Taken Place,120390
NA,Manual,30.0,Verify The Performance Dynamics Of The Operating Costs Of The Consolidated Perimeter,102352
NA,Manual,30.0,Verify The Performance Dynamics On The Consolidated Perimeter,122215
NA,Manual,30.0,Verify The Performance Dynamics,119583
NA,Manual,30.0,Verify That The Spreadsheet And Links Are Correct,102583
NA,Manual,30.0,Verify The Performance Dynamics,134961
NA,Manual,30.0,Verify The Performance Dynamics,109445
NA,Manual,30.0,Check The Performance Data,105417
Professional,Manual,30.0,Verify The Performance Dynamics Of The Parent CompanyS Operating Costs,120580
NA,Manual,30.0,Verify Segment Reporting Balances,128254
NA,Manual,0.1,Check That The Data Entered Manually Is Correctly Entered,119318
Operational,Manual,92.0,Check The Sending Of The Communication,101786
Professional,Manual,30.0,Check That Data Is Sent On Time,111035
NA,Manual,0.1,Verify Partial Enforcement Validity And Amount Congruence,114937
NA,Manual,0.1,Check The Validity Of The Total Enforcement And The Congruence Of The Amount,114936
Operational,Manual,30.0,Verify The Punctual Sending Of The Communication To The Spv,108588
Professional,Manual,30.0,Verify The Timely Sending Of The Communication,111034
Operational,Manual,0.1,Check The Completeness Of The Documentation,118960
Operational,Manual,0.1,Verify Compliance With The Terms And Correctness Of The Amount To Be Reimbursed Communicated.,121456
Operational,Manual,0.1,Verify That The Loan Has Been Extinguished,112278
Operational,Manual,182.0,Verify The Correctness Of The Refunded Amount,118746
NA,Manual,0.1,Check For Correct System Update,119950
NA,Manual,0.1,Verify Processing,102779
NA,Manual,0.1,Check Calculations For Central Asset Net Interest,129927
NA,Manual,30.0,Verification Of Calculations Of Unsustainable Indicators,102781
NA,Manual,30.0,Verify The Correct Calculation Of The Indicators,102780
NA,Manual,0.1,Check The Correct Entry Of Data In The Procedure,130832
NA,Manual,0.1,Check The Correct Entry Of Data In The Procedure,129750
NA,NA,,Verify The Information Submitted Electronically,112623
NA,NA,,Verify The Information Submitted Electronically,132700
NA,NA,,Verify The Identity Of The Applicant,113669
Operational,Manual,0.1,Check The Amounts To Be Settled And Make Payments,131622
Operational,Manual,0.1,Verify Receipt Of Funds,124938
Professional,Semi-automatic,30.0,Verify In The Passive Cycle The Consistency Between Availability And Committed And Final Balance,127987
NA,Semi-automatic,30.0,Check The Consistency Of The Estimates,121589
NA,Manual,0.1,Verify The Consistency And Correctness Of The Data In The System.,129968
NA,Manual,0.1,Verify The Consistency And Correctness Of The Trade In The System,102488
Operational,Manual,0.1,Check The Completeness Of The Form,125219
NA,Manual,1.0,Check The Correctness Of The Entered Data,117485
NA,Manual,0.1,Check The Transaction Data,107231
NA,Manual,, Check Again That The Ib&Sf ManagerS Consent Has Been Acquired For The Application Of The Commission Not In Line With The Cme Commission Tables,117547
NA,Manual,,Check Contents Of The Confidentiality Agreement,107176
NA,Manual,, Check That The Consent Has Been Acquired By The Ib&Sf Manager For The Application Of The Commission Not In Line With The Ecm Commission Tables,101184
NA,Manual,0.1,Verify The Operation In The Case Of Petroleum Products And Petrochemicals,130537
Operational,Manual,0.1,Carry Out Checks On Aml/Ctf Or Countering Terrorism Financing,130536
Operational,Manual,0.1,Fulfill The Fulfilments Foreseen For Aml/Ctf Or Countering The Financing Of Terrorism,116274
Operational,Manual,0.1,Fulfill The Fulfilments Foreseen For Aml/Ctf Or Countering The Financing Of Terrorism,106677
Operational,Manual,0.1,Carry Out Aml/Ctf Or Counter Terrorism Financing Checks,106676
NA,NA,,Tick What Is Authorized,116277
Operational,Manual,0.1,Carry Out The Fulfilments Foreseen In Terms Of Aml/Ctf Or Countering The Financing Of Terrorism,116977
Operational,Manual,0.1,Carry Out Checks On Aml/Ctf Or Countering Terrorism Financing,116976
NA,NA,,Tick What Is Authorized,116278
NA,NA,,Activity Tick Off What Is Authorised,116279
NA,Semi-automatic,0.1,Check Correct Update On Applications,123102
NA,Manual,0.1,Certify The Correctness Of The Level Of Fair Value And Day One Profit Determined,116737
NA,Semi-automatic,30.0,Verify The Correct Determination Of The Correlation,108004
NA,Manual,30.0,Check The Selected Price,117824
NA,Manual,30.0,Check Authorization And Correctness Of The Assessment,128136
NA,Manual,30.0,Check The Correctness And Completeness Of The Data Entered,116747
NA,Semi-automatic,30.0,Check The Correctness And Completeness Of The Data Entered,116749
NA,Semi-automatic,30.0,Check The Assigned Price,104762
NA,Manual,30.0,Check The Correctness And Completeness Of The Data Entered,117349
NA,Semi-automatic,30.0,Monitor Flow Between Front System And Evaluation System,108006
NA,Manual,30.0,Verify The Correct Entry Of Market Data,108003
NA,Manual,30.0,Verify Attribution Of Stress Parameters,117351
NA,Semi-automatic,30.0,Check The Calculation Of Fair Value,108005
NA,Manual,30.0,Check The Correctness Of Processing,120802
NA,Semi-automatic,30.0,Verify The Correctness Of The Credit Risk Adjustment Calculation,120235
NA,Semi-automatic,30.0,Verify The Completeness Of The Acquired Data,105425
NA,Automatic,30.0,Check The Completeness And Consistency Of The Data Entered,117350
NA,Manual,30.0,Verify Receipt Of All Available Trustee Reports,132525
NA,Manual,30.0,Check The Consistency Of The Prices Obtained,116748
NA,Manual,30.0,Check The Correctness And Completeness Of The Data Entered,120234
NA,Manual,30.0,Verify The Correct Insertion Of The Unwinding Operations,131471
NA,Semi-automatic,30.0,Verify The Correct Calculation Of The Base Correlation,108002
NA,Manual,30.0,Verify The Correct Update,104636
NA,Manual,30.0,Verify The Correct Update Of The Front Office System,132526
NA,Manual,92.0,Carry Out Capacity Checks,132738
NA,NA,,Verify Contracts And Acquired Documentation,107428
NA,Automatic,0.1,Prepare The Transfer Contracts Not Produced Automatically By The System,133956
NA,Semi-automatic,1.0,Verify The Correct Accounting Of The Operation,116704
NA,NA,,Check Acquisition Of Messages By The Bank Of Italy.,108763
NA,NA,,Evaluate And Validate The Request For Authorization To Access Restricted Areas,106102
NA,Manual,0.1,Check The Record Date,115289
Operational,Manual,182.0,Check The Correspondence Between The Offer And What Is Entered In The Applications,130229
NA,NA,,Check For The Presence Of The Weapons Code,124990
NA,NA,,"Verify The Consistency, Completeness Of Information And Compliance Of The Transaction",126677
NA,NA,,Check The Completeness Of The Documentation,111584
NA,NA,,"Verify The Consistency, Completeness Of Information And Compliance Of The Transaction",128267
NA,NA,,"Check The Consistency, The Completeness Of The Information",130481
NA,NA,,Check The Completeness Of The Documentation,126608
NA,NA,,Check For The Presence Of The Weapons Code,124186
NA,NA,,"Verify The Consistency, Completeness Of Information And Compliance Of The Transaction",135290
NA,Automatic,1.0,Check Outstanding Sdd Debit Provisions,127237
NA,Semi-automatic,30.0,Check For Unopted Assets,103064
NA,Manual,0.1,Verify The Closing Of The Financial Plan Of The Asset And Of The Contract,101288
NA,Semi-automatic,30.0,Check List Of Items With Blocked Redemption Value Charge,107363
NA,Manual,0.1,Verify The Correct Confirmation Of The Resolution,132111
NA,Manual,0.1,Verify The Completeness Of The Documentation Acquired By The Proponent,106307
NA,Manual,0.1,Verify Decision-Making Competence,106308
NA,Manual,0.1,Verify The Correct Execution Of The Sppi Test,105828
NA,Manual,0.1,Verify The Correct Fulfillment Of The Regulatory Obligations And The Presence Of All The Required Opinions,108324
NA,Manual,0.1,Verify The Correct Fulfillment Of The Regulatory Obligations And The Presence Of All The Required Opinions,129162
NA,Manual,0.1,Verify Decision-Making Competence,100952
NA,NA,,Check The Outcome Of The Collection Orders,119183
NA,Manual,0.1,Collect Authorization Signatures,113920
NA,Manual,0.1,Collect Signatures,116425
NA,Manual,0.1,Check The Documentation And Enter The Receipt,116922
NA,NA,,Verify The Absence Of Investment Proposals/Instructions For The Client To Be Reported,100507
NA,NA,,Check For Any Pending Updates,103115
NA,Manual,0.1,Verify The Correct Insertion Of The Guarantee In The Systems,132301
NA,Manual,0.1,Check And Validate The Entries In The Position Keeping System For Sending To Accounting,119955
NA,Semi-automatic,0.1,Verify The Correctness Of Inserting The New Deal,131769
NA,Manual,0.1,Check And Validate The Entries In The Position Keeping System,117384
NA,Manual,0.1,Check And Validate The Entries In The Position Keeping System For Sending To Accounting,119956
NA,Semi-automatic,0.1,Verify Correctness Of Inserting The New Deal,134040
NA,Manual,0.1,Validate Operation On The Bo System For Sending To Accounting,113726
NA,Manual,0.1,Verify Correctness Of The Reversal,131768
Professional,Manual,30.0,Verification Of Owned Metal In Stock,108331
NA,Manual,1.0,Verify The Materiality Of The Owned Metal,110650
Professional,Manual,0.1,Third Party Metal Verification,116472
NA,NA,,Check The Invoices Not Pertaining To It,134586
NA,Manual,0.1,Check The Sorting Of Invoices To The Corporate Subsystems,134384
NA,NA,,Check Addressing To Destination Applications,134585
NA,Semi-automatic,1.0,Check The Accounting Proposal,100609
NA,Semi-automatic,0.1,Check The Wire Transfer Proposal,104016
NA,Semi-automatic,1.0,Check If There Are Any Unsuccessful Transfers,108175
NA,Semi-automatic,1.0,Verify The Correct Confluence Of The Document In The Wf Circuit,124847
NA,Semi-automatic,1.0,Verify The Complete Loading Of The Documents In The Wf,124848
NA,Semi-automatic,1.0,Check The Accounting Proposal,124991
NA,Semi-automatic,1.0,Verify Registrability And Conformity Of Supplier Invoices,124849
NA,Manual,0.1,Check The Manual Payment,115211
NA,Manual,0.1,Check Accounting,100610
NA,Semi-automatic,0.1,Verify Payment Authorization,104015
NA,NA,,Verify The Correctness Of The Values Produced The Previous Day,125204
NA,Automatic,1.0,Verify The Correctness Of The Calculation Of The Comit Index,128629
NA,Manual,0.1,Check For Any Alerts Automatically Generated By The Management Application Following Verification Of The Validity Of The Prices Provided By The Infoproviders And To Report Unsent Values,126276
NA,NA,,Check That The Data Has Been Sent,118959
NA,Semi-automatic,0.1,Verify The Corrections Of The Structures / Companies Of The Group,125644
NA,Manual,182.0,Verify That All Packages In The Phase Are Certified,117178
NA,Semi-automatic,182.0,Check The Correct Compilation Of The Forms,132960
NA,Manual,182.0,Verify The Complete Fulfillment Of The Reliefs,111783
NA,Semi-automatic,0.1,Verify The Corrections Of The Structures / Companies Of The Group,100773
NA,Semi-automatic,182.0,Examine The Diagnostic Result,101284
NA,Semi-automatic,182.0,Run The Diagnostic Procedure At The Original Scenario Level And Verify Its Outcome,117459
NA,Manual,182.0,Carry Out A Trend Analysis Of The Data,117484
NA,Semi-automatic,182.0,Run Diagnostics At The Consolidated Scenario Level,117483
NA,Semi-automatic,182.0,Check The Diagnostics Returned By The Application,115368
NA,Automatic,182.0,Verify The Completion Of The Consolidation,107319
Operational,Manual,0.1,Check Sending And Acceptances,123636
NA,Manual,0.1,Verify The Reconciliation And Make The Appropriate Adjustments,121165
NA,Manual,1.0,Verify The Correct Creation And/Or Updating Of The Event,123879
NA,Manual,0.1,Verify Reconciliation And Make Appropriate Adjustments,132978
NA,Manual,1.0,Check If The Event Was Created Or Updated Correctly,114224
NA,Manual,365.0,Check That The Committees Have Been Convened,105968
NA,Manual,7.0,Check The Machining Of The Positions,127033
NA,Manual,1.0,Define Funding Or Employment Amounts,121486
NA,Manual,0.1,Check That The Entered Data Is Correct,121485
NA,Manual,0.1,Verify Data Correspondence,135342
NA,Manual,0.1,Verify That The Calculated And Paid Value Corresponds,105022
NA,Manual,0.1,Verify Correctness Of Payment,108731
Professional,Manual,0.1,Check That The Amount Of The Bank Transfer Received Relating To The Assignment Of Credits Corresponds To The Contractual Agreements Signed.,134557
NA,Manual,0.1,Verify That The Differences Have Been Accounted For,118354
NA,Manual,0.1,Verify Correctness Of Evaluation,129837
Professional,Manual,0.1,Verify Correctness Of The Information,101135
NA,Manual,0.1,Verify The Completeness And Correctness Of The Activities Performed,109255
Operational,Manual,0.1,Verify Completeness And Timeliness Of Subscriptions,104669
Operational,Manual,0.1,Check The Correctness And Completeness Of The Documentation,116807
Operational,Manual,0.1,Verify Completeness And Timeliness Of Subscriptions,123933
NA,Manual,0.1,Verify The Completeness And Correctness Of The Activities Performed,104263
Professional,Manual,0.1,Formal And Substantial Verification Of The Model,115070
Operational,Manual,0.1,Check By Another Employee Of The Facility,130403
Professional,Manual,0.1,Formal And Substantial Verification Of The Model,121989
NA,NA,,Verify The Completeness Of The Documentation Certifying The Exceeding Of The Lending Limit,116923
NA,NA,,Verify Correct Update Procedure,111616
NA,Semi-automatic,0.1,Check For Any Apparent Anomalies In The Data,134712
NA,Manual,0.1,Verify The Correct Update Of The Dashboard,132450
NA,Manual,, Verify Correct Entry Of The Text Of Conflicts Of Interest Sent By Conflict Check And Clearing Sensitive Operations,106264
NA,Manual,0.1,Check The Congruence Of The Operation On The Position Keeping,114586
NA,Manual,0.1,Check The Data Entered In The System,125778
NA,Manual,0.1,Verify The Adequacy Of The Amount,105542
NA,Manual,0.1,Check The Data Entered In The System,125777
NA,Manual,0.1,Verify Payment,125779
NA,Manual,0.1,Verify The Adequacy Of The Amount,105541
NA,Semi-automatic,30.0,Verify That The Data Has Been Imported Correctly,123150
NA,Semi-automatic,30.0,Verify The Correctness Of The File,132412
NA,Semi-automatic,30.0,Check For Any Errors Highlighted In The Reports,105360
NA,Manual,0.1,Verify The Correct Updating Of The Systems,132904
NA,Semi-automatic,30.0,Check The Data Upload,102187
NA,Semi-automatic,30.0,Verify The Success Of The Upload,105359
NA,Automatic,30.0,Check The Success Of The Work,110000
NA,Manual,30.0,Check That The Files Are Set Up Correctly,132906
NA,Manual,1.0,Check Alignment With Market Treasury Imi Cib,110784
NA,Manual,0.1,Verify The Correctness Of The Credited Amount And The Regular Accounting Towards The Pertinent Accounting Item,134772
NA,NA,,Load Data Into Tables,129270
Operational,Manual,0.1,Verify The Correct Census Of The Counterparty.,111776
Operational,Manual,0.1,Verify That The Data Is Loaded Correctly,131172
Operational,Manual,0.1,Verify The Proper Loading Of The Data,109172
Operational,Manual,0.1,Check That The Data Has Been Loaded Correctly,102160
NA,NA,,Verify Correct Connection,111209
NA,Semi-automatic,92.0,Check The Consistency Of The Reporting Schemes With The Cpm Module,124611
NA,Semi-automatic,92.0,Verify The Completeness And Correctness Of The Signage Schemes,124612
NA,Semi-automatic,92.0,Please Check The Submission For Completeness And Correctness,124613
NA,Semi-automatic,92.0,Verify The Correctness Of The Elimination And Creation Of The Mini-Consolidated Perimeter,116224
NA,Manual,0.1,Check The Completeness And Correctness Of The Information Entered,128867
NA,Semi-automatic,92.0,Verify The Complete Fulfillment Of The Reliefs,124614
NA,Semi-automatic,92.0,"Verify The Correctness, Completeness And Consistency Of The Package Data",112347
NA,Manual,0.1,Check Correct Completion Of The Form,100746
NA,Manual,0.1,Verify The Consistency And Correctness Between The Entered Trade And The Summary Data Received,114113
NA,Manual,0.1,Check The Interest And Skills Calculation,100747
NA,Manual,0.1,Verify The Consistency And Correctness Of The Data In The System,101149
NA,Manual,0.1,Check For Any Arrears Of Contributions,119769
NA,Manual,1.0,Verify Practices With Data Entered Automatically,134094
NA,Manual,0.1,Check The Results Of The Requests,105553
NA,Manual,0.1,Verify The Correctness Of The Amounts Received,129164
NA,Manual,0.1,Verify The Correctness Of The Pa Data,130829
NA,Manual,0.1,Verify The Congruence Of The Ead Data,130828
NA,Manual,0.1,Check The Correctness Of The Integrated Pa Calculation,126353
NA,Manual,0.1,Verify The Correctness Of The Built-In Ead Calculation,126352
NA,Manual,182.0,Monitor Requested Refunds,127121
NA,Manual,30.0,Check The Correctness Of The Entered Data,127119
NA,NA,,Verify The Adequacy Of The Certificate And Compliance With Delivery Times,105831
NA,Manual,0.1,Verify The Completeness Of The Identified Perimeter,122677
Professional,Manual,0.1,Verify The Completeness And Adequacy Of The Information Received,114054
NA,Manual,0.1,Check The Correct Accounting Of The Collection,109071
NA,Manual,0.1,Verify That The Assignment Has Been Stipulated Correctly,120981
NA,Manual,0.1,Verify That The Assignment Has Been Notified Correctly,130241
NA,Manual,0.1,Check The Correctness Of The Entered Data,110223
NA,NA,,Check The Receipt Issued By The Financial Administration,112127
NA,NA,,Verify The Correctness And Completeness Of The Information,121809
NA,NA,,Check That The Model Has Been Archived,121810
NA,NA,,Check That The Calculation Has Been Completed,124898
NA,Semi-automatic,92.0,Verify The Correctness Of The Calculation Performed,110220
NA,Manual,0.1,Check The Correctness And Completeness Of The Information Entered,130002
NA,Manual,0.1,Check The Request For Information Of A Technological Nature,104796
NA,Manual,0.1,Check The Request For Information Security Components,104797
NA,Manual,0.1,Verify The Conclusion Of The Interventions And Fulfilments Consequent To The Release Of The Opinion,106153
NA,Manual,0.1,Check The Closure Of Practices And Active Amendments,132132
Operational,Manual,365.0,Verify That The Practices With Approved Risk Are Cloned,133990
NA,Manual,365.0,Check The Approval Level Of Practices With Estimated Data,130834
NA,Manual,30.0,Verify Compliance With The Timescales Envisaged By The Specific Intervention,106245
NA,Manual,0.1,Check The Correct Entry Of The Variation Entered In The Procedure,106246
NA,Manual,0.1,Verify The Correctness Of The Acquired Documentation,106244
NA,Manual,0.1,Verify The Correct Stipulation,128623
NA,Manual,92.0,Check For Unjustified Positions,124687
NA,Semi-automatic,30.0,Verify The Correctness Of The Pv Information,124136
NA,Semi-automatic,30.0,Structure Reports Of Invoices Not Yet Collected,119768
NA,Semi-automatic,0.1,Check For Any Blockage Signals,113402
NA,Semi-automatic,1.0,Supervise The Regulation Chain,114167
NA,Semi-automatic,0.1,Check For Any Blockage Signals,117788
Operational,Manual,0.1,Check For Blocked Operations,118552
NA,Semi-automatic,0.1,Check For Any Blocked Operations,122707
NA,Semi-automatic,1.0,Check Blocked Operations,123912
NA,Semi-automatic,0.1,Verify The Outcome Of The Sppi Tests Performed,107540
NA,Semi-automatic,0.1,Verify The Outcome Of The Sppi Tests Performed,101383
NA,Semi-automatic,0.1,Check For Any Blockage Signals,130099
Operational,Manual,0.1,Verify The Correctness Of The Operation On The Position Keeping,122098
NA,Manual,0.1,Check That The Information Entered Is Correct,129156
NA,Manual,0.1,Check That The Information Entered Is Correct,129155
NA,Manual,7.0,Prepare Performance Analysis,111689
NA,Automatic,0.1,Verify Consistency Of Cc Balances With Salent Accounting Records,103354
NA,Manual,30.0,Verify Month-End Analytical Output Published In The Reporting Area Lrs,131149
Professional,Manual,0.1,Check List Of Operations Received,105105
Professional,Manual,0.1,Check Entered Data,126025
NA,Semi-automatic,3650.0,Check Data Acquisition In Lrs,101627
NA,Manual,30.0,Check If The Data Indicated In The Reporting Flow Are Different From Those In The Archive,118835
NA,Manual,30.0,Check Signaling Process Power Supply,111926
Professional,Manual,30.0,"Verify Data Received For Consolidated Regulatory And Management Reporting - Lcr, Nsfr And Amm Indicators",101405
Professional,Manual,3650.0,Analyze The Variations And Check The Performance Trend,108213
NA,Manual,30.0,Verify Consistency Between Management Data And Feeding Of Reported Flows,111927
